Song-Name,Singer/Artists,Genre
Tu Hi Meri Shab Hai,K.K.,Romantic
Koi Ladki Hai,"Lata Mangeshkar, Udit Narayan",Dance
Bheege Hont Tere,Kunal Ganjawala,RomanticSensual
Mere Samne Wali Khidki Mein,Kishore Kumar,DanceRomantic
Is Mod Se Jaate Hain,"Kishore Kumar, Lata Mangeshkar",Romantic
Chamak Challo Chel Chabeli,"Kumar Sanu, Shreya Ghoshal",
Chandni O Meri Chandni,YRF,Dance
Mere Khwabon Mein,Lata Mangeshkar,Romantic
Rock N Roll Soniye,"Mahalakshmi Iyer, Shaan, Shankar Ehsaan Loy, Shankar Mahadevan",Dance
Keeda,"Himesh Reshammiya, Neeti Mohan",Dance
Abhi Kuch Dino Se,Mohit Chauhan,Dance
Dheere Dheere (Remix),Yo Yo Honey Singh,Dance
Dil Ne Ye Kaha Hai Dil Se,"Alka Yagnik, Sonu Nigam",RomanticSad
Mohabbat Hai Kya Cheez,"Lata Mangeshkar, Suresh Wadkar",Romantic
Soldier Soldier Meethi Baaten,"Alka Yagnik, Kumar Sanu",Dance
Tum Bin,Shreya Ghoshal,Sad
Tum Ho Mera Pyar,"K.K., Suzanne D'Mello",Romantic
Dard Dilo Ke  (Reprise),Mohammed Irfan,Dance
Shirdi Wale Sai Baba,Mohammed Rafi,Devotional
Na Jane Kahan Se,"Amit Kumar, Kavita Krishnamurthy",Dance
Bol Beliya,"Siddharth Mahadevan, Sunidhi Chauhan",Dance
Jee Karda,"Labh Janjua, Suzanne D'Mello",Dance
Tum Bin,Ankit Tiwari,Sad
Aadat,"Jubin Nautiyal, Raftaar, Shirley Setia",Romantic
Tere Liye,Ankit Tiwari,Romantic
Mera Rang De Basanti,"Manmohan Waris, Sonu Nigam",Patriotic
Hum Tumhare Hain Sanam,"Anuradha Paudwal, Udit Narayan",Romantic
Nain Phisal Gaye,Payal Dev,Romantic
Boond Boond,Ankit Tiwari,Sad
Bipasha,"Shadab Faridi, Shraddha Pandit",Dance
Dhoom Tana,"Abhijeet, Shreya Ghoshal",Dance
Tu Hi Mera,Shafqat Amanat Ali,Romantic
A B C D E F G H,"Hariharan, Shankar Mahadevan, Udit Narayan",Dance
Moh Moh Ke Dhaage,"Monali Thakur, Papon",Sad
ABCD Yaariyan,"Benny Dayal, Shefali Alvares",Dance
Hona Tha Pyar,"Atif Aslam, Hadiqa Kiani",Romantic
ABCD,"Benny Dayal, Shefali Alvares, Yo Yo Honey Singh",Dance
Kaise Mujhe,Benny Dayal,Romantic
Whats Up,"Jasleen Royal, Mika Singh",Dance
Dhaakad,Raftaar,
Masakali,Mohit Chauhan,Dance
Tumhe Jo maine Dekha,Abhijeet,Dance
Gal Ban Gayi (Remix),"Meet Bros, Neha Kakkar, Sukhbir, Yo Yo Honey Singh",Dance
Koyal Si Teri Boli,"Anuradha Paudwal, Udit Narayan",Dance
Tu Hi Na Jaane,"Prakriti Kakkar, Sonu Nigam",
Hum Lakh Chupaye,"Asha Bhosle, Kumar Sanu",Romantic
Ek Villain,Multiple,Dance
Tujhe Dekhti Hai Nazar,Mohd. Irfan,Romantic
Beedi,"Clinton Cerejo, Nachiketa, Sukhwinder Singh, Sunidhi Chauhan",Dance
Chori Chori Dil Le Gaya,"Hema Sardesai, Sukhwinder Singh",Dance
Raasleela,Sumedha Karmahe,Dance
Dum Maaro Dum,Anushka Manchanda,Dance
Kudiyan Sehar Diyan,"Alka Yagnik, Daler Mehndi",Dance
Dhunki,Neha Bhasin,Dance
Tera Deedar Hua,Rahat Fateh Ali Khan,Romantic
Salaam India,"Salim Merchant, Vishal Dadlani",MotivationalPatriotic
Hum Ko Maaloom Hain,"Sadhana Sargam, Sonu Nigam",Romantic
Bodyguard,"Band of Power, Salman Khan",Dance
Pyaara Bhaiya Mera,"Alka Yagnik, Kumar Sanu",Dance
Chahoon Bhi,"Bombay Jayashri, Karthik",Romantic
Babul Pyare,Lata Mangeshkar,Dance
Bade Miyan Chote Miyan,"Sudesh Bhosle, Udit Narayan",Dance
Albela Sajan,"Kanika Joshi, Kunal Pandit, Prithvi Gandharva, Rashi Raagga, Shashi Suman",Dance
Nahin Saamne Tu,"Hariharan, Sukhwinder Singh",Romantic
Goron Ki Na Kalon Ki,"Suresh Wadkar, Usha Mangeshkar",Dance
Gum Hai Kisi Ke Pyar Mein,"Kishore Kumar, Lata Mangeshkar",Romantic
Tu Mere Agal Bagal Hai,Mika,Dance
Aashiyan,"Nikhil Paul George, Shreya Ghoshal",Dance
Pyar Ka Anjaam,"Alka Yagnik, Kumar Sanu, Sapna Mukherjee",Romantic
Ay Hairathe,"A.R. Rahman, Alka Yagnik, Hariharan, Mohammed Aslam",Romantic
Phir Kya Hai Gham,Shilpa Rao,
Hip Hop Pammi,"Mika Singh, Monali Thakur",Dance
Jab Se Mere Naina,Shaan,DanceRomantic
Race Saanson Ki,"Neeraj, Sunidhi Chauhan",Dance
Tu Chale Toh,Papon,Romantic
Chori Chori Chupke Chupke,"Shreya Ghosal, Udit Narayan",DanceRomantic
Pairon Mein Bandhan Hai,"Manohar Shetty, Preetha Mazumdar, Sonali Bhatawdekar, Udbhav",Dance
Tum Par Hum Hai Atke Yaara,"Kavita Krishnamurthy, Kumar Sanu",Dance
So Gaya Yeh Jahan,"Alka Yagnik, Nitin Mukesh, Shabbir Kumar",Dance
Wo Ladki Jo Sabse,Abhijeet,Dance
Sara Zamana,Kishore Kumar,Dance
Aur Is Dil Mein,"Asha Bhosle, Suresh Wadkar",Sad
Mujhse Shaadi Karogi,"Sonu Nigam, Sunidhi Chauhan, Udit Narayan",Dance
Challa,"Babbu Maan, Suzanne D'Mello",Dance
Tu Hi Toh Meri Dost Hai,"A.R. Rahman, Benny Dayal, Shreya Ghoshal",Dance
Maa Sheranwali,Shabbir Kumar,Devotional
Kuch Din,Jubin Nautiyal,Romantic
Tu Na Ja Mere Badshah,"Alka Yagnik, Mohammad Aziz",Sad
Rani Tu Mein Raja (,"Bhavya Pandit, Mika Singh, Yo Yo Honey Singh",Dance
Rani Tu Mein Raja (,"Bhavya Pandit, Mika Singh, Yo Yo Honey Singh",Dance
Bholi Si Surat,"Lata Mangeshkar, Udit Narayan",Romantic
Tere Naina,"Shaan, Shreya Ghoshal",Romantic
O Rangrez,Divya Kumar,Romantic
Jise Dekh Mera Dil Dhadke,Kumar Sanu,Romantic
Tumko To Aana Hi Tha,"Armaan Malik, Marianne D'Cruz",Romantic
Khwaab Ho Tum Ya Koi,Kishore Kumar,Romantic
Chor Bazari,Neeraj Shridhar,Dance
Jaati Hoon Main,"Alka Yagnik, Kumar Sanu, Udit Narayan",
Saanson Ne,"Sonu Nigam, Tulsi Kumar",Romantic
Mr. Lova Lova,"Abhijeet, Kavita Krishnamurthy, Sudesh Bhosle, Udit Narayan, Vibha Sharma",Dance
Ladka Yeh Kehta Hai,K.K.,Dance
Tum Dil Ki Dhadkan Mein,"Abhijeet, Alka Yagnik, Kumar Sanu",Romantic
Halla Re,"Salim Merchant, Shweta Pandit",Dance
Tu Bhoola Jise,K.K.,Patriotic
Teri Yaad,"Badshah, Himesh Reshammiya",Sad
Tum Saanson Mein,"Himesh Reshammiya, Tulsi Kumar",Romantic
Yeh Jo Des Hai Tera,A.R. Rahman,Patriotic
Jab Tak Hai Jaan,Shakthi Sree Gopalan,Romantic
Teri Yaad Aati Hai,"Lata Mangeshkar, Suresh Wadkar",Sad
Jee Le Zaraa,Vishal Dadlani,Romantic
Bekarar Karke Hume,Hemant Kumar,Romantic
Tumhari Nazar Kyon Khafa Ho Gayi,"Lata Mangeshkar, Mohammed Rafi",
Chichora Piya,"Himesh Reshammiya, Shalmali Kholgade",Dance
Soniye Ve – Dhak Dhak Dhak,"Sonu Nigam, Sunidhi Chauhan",Dance
Tere Bin,Atif Aslam,Sad
Phir Mohabbat,"Arijit Singh, Mohammed Irfan, Saim Bhat",RomanticSad
O Heeriye,Ayushman Khurana,Romance
O Heeriye,Ayushman Khurana,Sad
Hummein Tummein Jo Tha,"Palak Muchhal, Papon",Sad
Dil Chura Le,"Alka Yagnik, Kumar Sanu",Romantic
Kaun Hai Jo Sapnon Mein Aaya,Mohammed Rafi,Romantic
Mar Jaawan Mit Jaawan,"Abhijeet Sawant, Sunidhi Chauhan",Dance
Mar Jaawan Mit Jaawan,"Abhijeet Sawant, Sunidhi Chauhan",Dance
Jhuki Jhuki Si Nazar,Jagjit Singh,Sad
Zor Ka Jhatka,"Daler Mehndi, Master Saleem, Richa Sharma",Dance
I Am A Disco Dancer,Bappi Lahiri,Dance
Sufi Salam,Rahat Fateh Ali Khan,Romantic
Ishq Samundar,"Himesh Reshammiya, Kanika Kapoor",Dance
Na Na Karte Pyar,Alka Yagnik,DanceRomantic
Tu Rootha Dil Toota,Kishore Kumar,Sad
Katra Katra,"Ankit Tiwari, Prakriti Kakar",Romantic
Yaara O Yaara,"Lata Mangeshkar, Suresh Wadkar",Sad
Let’s Celebrate,Imran Khan,Dance
Alfazon Ki Tarah (Unplugged),"Ankit Tiwari, John Abraham, Shreya Ghoshal",Sad
Jaane Dil Mein,"Lata Mangeshkar, Sonu Nigam",Romantic
Trippy,"Himesh Reshammiya, Neha Kakkar",Dance
Dil Jaane Na,"Mohit Chauhan, Neeti Mohan",Romantic
Da Da Dasse,"Babu Haabi, Kanika Kapoor",Dance
O Re Kaharo,"Altamash Faridi, Kalpana Patowary",Sad
Ramaiya Vatsavaiya,"Lata Mangeshkar, Mohammed Rafi, Mukesh",Dance
Fashion Khatam Mujhpe,"Mamta Sharma, Shabab Sabri, Wajid",Dance
Kya Dekhte Ho Surat Tumhari,"Asha Bhosle, Mohammed Rafi",Romantic
Kudiye Di Kurti,"Neuman Pinto, Shazneen Arethna, Shreya Ghoshal, Sonu Nigam",Dance
Beat Juunglee,"Armaan Malik, Prakriti Kakkar",Dance
Ya Rabba,Kailash Kher,Sad
Khwab Dekhe Sexy Lady,"Monali Thakur, Neeraj Shridhar",Dance
Ishqa,"Abhijeet Sawant, Antara Mitra",
Aahun Aahun,"Ashish Pandit, Jaspreet Singh, Master Saleem, Suzanne D'Mello",Dance
Aahun Aahun,"Ashish Pandit, Master Saleem, Suzanne D'Mello",Dance
Dil Dance Maare,"Sukhwinder Singh, Sunidhi Chauhan, Udit Narayan",Dance
Kitni Baatein,"Hariharan, Sadhana Sargam, Shankar Ehsaan Loy",Sad
Kitni Baatein,"Hariharan, Sadhana Sargam",Sad
Char Baj Gaye (Party Abhi Baaki Hai),Hard Kaur,Dance
Aa Gaya Aa Gaya,Udit Narayan,Dance
Chand Sitare,Kumar Sanu,Romantic
Bhanware Ne Khilaya Phool,"Lata Mangeshkar, Suresh Wadkar",Dance
O Piya O Piya,"Sadhana Sargam, Sukhwinder Singh",Romantic
Dekha Tujhe Toh,"Alka Yagnik, Kumar Sanu",Romantic
Engine Ki Seeti,"Resmi Sateesh, Sunidhi Chauhan",Dance
Yeh Jawaani Hai Deewani (Mashup),"Arijit Singh, Mohit Chauhan",Dance
Main Heroine Hoon,Aditi Singh Sharma,Dance
Punjabi Mast,"Alamgir Khan, Ankit Tiwari, Arya Acharya, Himesh Reshammiya, Vineet Singh",Dance
Mere Hathon Mein Nau Nau,Lata Mangeshkar,Dance
Heer,"Arijit Singh, Harshdeep Kaur",Dance
Mere Bina,Nikhil Dsouza,Romantic
Ishq Chupta Nahi Chupane Se,Abhijeet,Sad
Ishq Chupta Nahi,Abhijeet,Romantic
Tu Jahaan,Sonu Nigam,RomanticSad
Girls Like To Swing,Sunidhi Chauhan,Dance
Tu Kamaal Di Kudi,"Mamta Sharma, Vineet Singh",Dance
Tu Kamaal Di Kudi,"Mamta Sharma, Vineet Singh",Dance
Sapne Mein,"Asha Bhosle, Suresh Wadkar",Dance
Sadka,"Mahalakshmi Iyer, Suraj Jagan",
Dekho Dekho Jaanam,"Alka Yagnik, Udit Narayan",Dance
Chhan Ke Mohalla,"Ritu Pathak, Sunidhi Chauhan",Dance
Kaahe Chhed,"Kavita Krishnamurthy, Madhuri Dixit, Pandit Birju Maharaj",Dance
Aate Jaate Jo Milta Hai,"Alka Yagnik, Sonu Nigam",Dance
Uff Teri Adaa I Like You,"Alyssa Mendonsa, Shankar Mahadevan",Dance
Pant Mein Gun,Diljit Dosanjh,Dance
Bachna Ae Haseeno,"Kishore Kumar, Sumit Kumar, Vishal Dadlani",Dance
Ang Se Ang Lagana,"Alka Yagnik, Devki Pandit, Sudesh Bhosle, Vinod Rathod",Dance
Janib (Duet),"Arijit Singh, Sunidhi Chauhan",Romantic
Seedha Saadha,Amit Mishra,Sad
Aaya Re,"Kunal Ganjawala, Sunidhi Chauhan",Dance
Koi Fariyaad,Jagjit Singh,Sad
Rangreli,"Shreya Ghoshal, Wajid",Dance
Loot Jayenge,"Jayesh Gandhi, Kunal Ganjawala",Dance
Pyar Kiya To Darna Kya,Lata Mangeshkar,Dance
Hum To Bhai Jaise Hain,Lata Mangeshkar,Dance
Jatt Jaguar,"Apeksha Dandekar., Navraj Hans, Vishal Dadlani",Dance
Yaad Aa Raha Ha,Bappi Lahiri,Dance
Glamorous Ankhiyaan,"Anjjan, Krishna Beura, Meet Bros",Dance
Kitni Mohabbat Kis Ko,"Alka Yagnik, Kumar Sanu, Udit Narayan",Romantic
Tera Mera Rishta Purana,Mustafa Zahid,Sad
Bin Tere,"Shafqat Amanat Ali, Sunidhi Chauhan",Sad
Tere Dil Ka Rishta,Sonu Nigam,Romantic
Om Mangalam,"Nindy Kaur, RDB",Dance
Chhupana Bhi Nahin Aata,Vinod Rathod,Romantic
Hum Pyar Karne Wale,"Adnan Sami, Anuradha Paudwal, Udit Narayan",Romantic
Khwabon Khwabon,K.K. Suchitra,Dance
Yeh Haseen Vadiyan Yeh Khula Aasman,"A.R. Rahman, K. S. Chithra, S.P. Balasubrahmanyam",Romantic
Yeh Hawa Yeh Bata,Lata Mangeshkar,Dance
Khulke Dulke,"Gippy Grewal, Harshdeep Kaur",Dance
Musu Musu,Shaan,Romantic
Sajh Dhaj Ke,"Mika Singh, Pankaj Kapur",Dance
Dhiktana – 2,"Lata Mangeshkar, S.P. Balasubrahmanyam, Udit Narayan",Dance
Pinky,"Mamta Sharma, Meet Bros Anjjan",Dance
Mujhe Kitna Pyar Hai Tumse,"Lata Mangeshkar, Mohammed Rafi",Romantic
The Disco Song (Remix),"Benny Dayal, Salim Merchant, Shahid Mallaya, Sunidhu Chauhan, Udit Narayan",Dance
Yeh Ishq Hai Gunah,"Sukhwinder Singh, Sunidhi Chauhan",Romantic
Kabhi Shaam Dhale,Lucky Ali,Dance
In Lamhon Ke Daaman Mein,Javed Ali,Romantic
Agar Main Kahoon,"Alka Yagnik, Udit Narayan",Romantic
Kaddu Katega,Antara Mitra,Dance
Ishaqzaade,"Javed Ali, Shreya Ghoshal",Dance
Race 2 (Mashup),Multiple,Dance
Allah Ke Bande,Kailash Kher,Sad
Aisa Jadoo,Sunidhi Chauhan,Dance
Saanson Ki Mala,Kavita Krishnamurthy,Dance
Mar Jayian,"Sunidhi Chauhan, Vishal Dadlani",
Prabhu Ji,Asees Kaur,Devotional
Baby Doll (Remix),"Kanika Kapoor, Meet Bros",Dance
Aa Tayar Hoja,Sunidhi Chauhan,Dance
Humko Pyaar Hua,"K.K., Tulsi Kumar",Romantic
Jugni Peeke Tight Hai,"Divya Kumar, Kanika Kapoor, Sukriti Kakkar",Dance
Mere Rang Mein Rangne Wali,"Asad Bhopali, S.P. Balasubrahmanyam",Romantic
Toh Phir Aao,Mustafa Zahid,Sad
Ajnabi Mujhko Itna Bata,"Asha Bhosle, Jatin-Lalit, Udit Narayan",Romantic
Dil Dhadakne Do,"Joi Barua, Shankar Mahadevan, Suraj Jagan",
Tu Mere Paas,Ankit Tiwari,Sad
Dhat Teri Ki,"Aditi Singh Sharma, Sanam Puri",Dance
Der Se Aana Jaldi Jaana,"Alka Yagnik, Manhar Udhas",Dance
Jazba,Shilpa Rao,Dance
Is This Love – Kahin Na Laage,"Mohit Chauhan, Shreya Ghoshal",Dance
Bol Radha Bol,Mukesh,Romantic
Tu Hi Khwahish,Sunidhi Chauhan,Dance
Chak De India,"Marianne D'Cruz, Salim Merchant, Sukhwinder Singh",Dance
Ruk Ja O Dil Deewane,Udit Narayan,Romantic
Nanga Punga Dost,Shreya Ghoshal,Dance
Tanhayee,Sonu Nigam,Sad
Beat It Bijuriya,"Asees Kaur, Renesa Baadchi",Dance
Tum Saath Ho Jab Apne,"Asha Bhosle, Kishore Kumar",Dance
Most Wanted Munda,"Earl Edgar, Meet Bros",Dance
Mehram,Arijit Singh,Dance
Naina,Rahat Fateh Ali Khan,Sad
Sab Kuchh Bhula Diya,"Sapna Awasthi, Sonu Nigam",Sad
Ungli Pe Nachalein,"Dev Negi, Shipra Goyal",Dance
Do Me A Favour Let’s Play Holi,"Anu Malik, Sunidhi Chauhan",Dance
Aise Na Mujhe Tum Dekho,Kishore Kumar,Romantic
Kahin Door Jab Din Dhal Jaye,Mukesh,Romantic
Gilehriyaan,Jonita Gandhi,
Tanha Tanha Yahan Pe Jeena,Asha Bhosle,Dance
Khwahishein,Shreya Ghoshal,Romantic
Zindagi Kaisi Hai Paheli,Manna Dey,Dance
Sachi Muchi,"Harshdeep Kaur, Mohit Chauhan",Dance
Saawli Saloni Teri,"Alka Yagnik, Kumar Sanu",Romantic
Soniye,"K.K., Sunidhi Chauhan",Romantic
Koi Yeh Kaise Bataye,Jagjit Singh,Sad
Dekho Nashe Mein,"K.K., Shaan, Sunidhi Chauhan",Dance
Mein Sharabi,Yo Yo Honey Singh,Dance
Ho Sarkay Leo Khattiya Jada Lage,"Kumar Sanu, Poornima",Romantic
Nadiya Chale Chale Re Dhara,Manna Dey,Dance
Khatam Kahani,"Jyoti Nooran, Sultana Nooran, Vishal Mishra",
Jiya Jale,"Lata Mangeshkar, M.G. Sreekumar",Dance
Manva Likes To Fly,Shalmali Kholgade,Dance
Aashayein,"KK, Salim Merchant",Motivational
Aur Kya,Abhijeet,DanceRomance
Aisa Kyoon Hota Hai,Alka Yagnik,Romantic
Aaja Shaam Hone Aayi,"Lata Mangeshkar, S.P. Balasubrahmanyam",Dance
Cocktail Mashup,Multiple,Dance
Teri Mehfil Mein Kismat Azmakar,"Lata Mangeshkar, Shamshad Begum.",Dance
Pandey Jee Seeti,"Mamta Sharma, Shreya Ghoshal, Wajid",Dance
Ye Jawaani Teri,"Jonita Gandhi, Nakash Aziz",Dance
Ghar Aaja Pardesi,,Dance
Kitaben Bahut Si,"Asha Bhosle, Vinod Rathod",Dance
Jahan Teri Yeh Nazar Hai,Kishore Kumar,Dance
Namak Paare,"Anupam Amod, Mamta Sharma",Dance
Nazdeekiyan,"Neeti Mohan, Nikhil Paul George",Romantic
Jhumritalaiyya,"Arijit Singh, Mohan Kanan",Dance
Pyar Dilon Ka Mela Hai,"Alka Yagnik, Sonu Nigam",DanceRomantic
Aap Ki Ankhon Mein Kuch,"Kishore Kumar, Lata Mangeshkar",Romantic
Haawa Haawa,Mohit Chauhan,Dance
Baatein Ye Kabhi Na (Female),Palak Muchhal,Romantic
Lakh Lakh,Neeraj Shridhar,Dance
Yari Hai Imaan Mera,Manna Dey,Dance
O Mere Sanam,"Lata Mangeshkar, Mukesh",Sad
Daag,Sukhwinder Singh,Sad
Koi Kahe Kehta Rahe,"K.K., Shaan, Shankar Mahadevan",Dance
Mere Khayalon Ki Malika,Abhijeet,Romance
Krazzy 4,Vishal Dadlani,Dance
Sun Zara,Adnan Sami,Romantic
Zinda Rehti Hain Mohabbatein,"Lata Mangeshkar, Udit Narayan",Sad
Titliyan,Sunidhi Chauhan,Dance
Jeete Hain Chal,Kavita Seth,Sad
Hum Tum,"Alka Yagnik, Babul Supriyo",Romantic
Yun Hi Chala Chal,"Hariharan, Kailash Kher, Udit Narayan",Dance
Dooriyan,Mohit Chauhan,Sad
Yeh Hum Aa Gaye Hain Kahaan,"Lata Mangeshkar, Udit Narayan",Romantic
Yaar Na Miley (Remix),"Jasmine Sandlas, Yo Yo Honey Singh",Dance
Yaar Naa Miley (Remix),"Jasmine Sandlas, Yo Yo Honey Singh",Dance
Joganiyan,Shruti Haasan,Romantic
Huzur Is Kadar,"Bhupinder Singh, Suresh Wadkar",Dance
Aye Zindagi Gale Lagaa Le,Suresh Wadkar,Romantic
Surmayee Ankhiyon Mein,"Ilaiyaraaja, K.J. Yesudas",Romantic
Meri Ada Bhi,"Rahat Fateh Ali Khan, Tulsi Kumar",DanceRomantic
Waada Raha Sanam,"Abhijeet, Alka Yagnik",DanceRomantic
Tumse Hi Tumse,"Caralisa Monteiro, Shekhar Ravjiani",Romantic
"Gori Ka Sajan, Sajan Ki Gori","Mohammad Aziz, S. Janaki",Dance
Falak Dekhun,Sonu Nigam,Dance
Shikdum,"Shaan, Shreya Ghoshal",DanceRomantic
Bezubaan,K.K.,Romantic
Mere Bina Tu (Duet Version),"Harshdeep Kaur, Pritam",Sad
Alisha,"Anushka Manchanda, Salim Merchant",Dance
Aaj Kal Yaad Kuch Aur Rehta Nahin,Mohammad Aziz,Romantic
Dil Kho Gaya,"Anuradha Paudwal, Udit Narayan",Romantic
Sun Soniye,"Antara Mitra, Mohammed Irfan",Romantic
Baadal,Sunidhi Chauhan,Sad
Ae Mere Humsafar,"Alka Yagnik, Vinod Rathod",Romantic
Idhar Chala Mein Udhar Chala,"Alka Yagnik, Udit Narayan",Dance
Kise Dhoondta Hai Pagal Sapare,Anuradha Paudwal,Dance
Mere Dushman Mere Bhai,Hariharan,Sad
Aye Meri Zohra Jabeen,Manna Dey,Dance
Aye Dil Laaya Hai Bahaar,"Hariharan, Kavita Krishnamurthy",Dance
Bad Baby,"Badshah, Gippy Grewal",Dance
Dil Kyun Yeh Mera,K.K.,Romantic
Tum Se Milke,"Asha Bhosle, Suresh Wadkar",Romantic
Dhup Chik,"Badshah, Raftaar",Dance
Aadha Ishq,"Natalie Di Luccio, Shreya Ghoshal",Romantic
Pink Lips (Remix),Khushboo Grewal,Dance
Paathshaala,"Blaaze, Mohammed Aslam, Naresh Iyer",Dance
Ala Barfi,Mohit Chauhan,Dance
Kudi Tu Butter,Yo Yo Honey Singh,Dance
Churiyan Kanak Gayee,"Ila Arun, Lata Mangeshkar, Moinuddin Manchala",Dance
Kapoor & Sons (Mashup),Multiple,Dance
Mujhse Dosti Karoge,"Alka Yagnik, Asha Bhosle, Udit Narayan",Romantic
Hum To Dil Se Haare,"Alka Yagnik, Udit Narayan",Sad
Soniye,K.K.,Romantic
Albela Sajan,"Kavita Krishnamurthy, Shankar Mahadevan, Ustad Sultan Khan",Dance
Ehsan Tera Hoga Mujh Par,Mohammed Rafi,Romantic
Rola Pe Gaya,"Earl D'Souza, Hard Kaur, Mahadevan, Mahalakshmi Iyer, Master Saleem, Shankar",Dance
Bande Mein Tha Dum… Vande Mataram,"Pranab Biswas, Shreya Ghoshal, Sonu Nigam",Dance
Jawani Janeman,Asha Bhosle,Dance
Yahi Hota Pyaar,"Himesh Reshammiya, Sunidhi Chauhan",Sad
Jawani Janeman,Asha Bhosle,Dance
Aa Aa E Ooh Ooh Ooh Mera Dil Na Todo,Abhijeet,Dance
Main To Raste Se Ja Raha Tha,"Alka Yagnik, Kumar Sanu",Romantic
Awaarapan Banjarapan,M. M. Keeravani,Dance
Yeh Raat Aur Yeh Doori,"Asha Bhosle, S.P. Balasubrahmanyam",Dance
Mere Dil Jigar Se Guzree Hai,"Alka Yagnik, Kumar Sanu",Dance
Yeh Dil Jo Hai Badmaash Hai,"Mohit Chauhan, Monali Thakur, Shreya Ghoshal",Dance
Saawali Si Raat,Arijit Singh,Romantic
Aaankhein Milayenge Darr Se,"K. Mohan, Neha Bhasin",Dance
Ishq Vishq,"Kamaal khan, Sunidhi Chauhan, Suzanne D'Mello",Romantic
Hoshwalon Ko Khabar Kya,Jagjit Singh,Sad
Ghoomar,"K.K., Sunidhi Chauhan",Dance
Dil Mere,Kumar Sanu,Dance
Mujhe Haq Hai,"Shreya Ghoshal, Udit Narayan",Romantic
Musafir,Tushar Joshi,Romantic
Chalak Chalak,"Shreya Ghoshal, Udit Narayan, Vinod Rathod",Dance
Subah Subah,"Shekhar Ravjiani, Vishal Dadlani, Zubeen Garg",Dance
Pyar Kar,"Lata Mangeshkar, Udit Narayan",Romantic
O Jaana Na Jaana,"Kumar Sanu, Lata Mangeshkar",Romantic
Mhare Hiwra Main Nache Mor,"Alka Yagnik, Anuradha Paudwal, Hariharan, Kavita Krishnamurthy, Kumar Sanu, Udit Narayan",Dance
Raitaa Phail Gayaa,Divya Kumar,Dance
Tere Bina,Rahat Fateh Ali Khan,Romantic
Sava Dollar (Lavni),Sunidhi Chauhan,Dance
Baba Meri Yeh Jawani,Falguni Pathak,Dance
Deewana Main Chala,Udit Narayan,Dance
Zindagi Ki Yahi Reet Hai,Kishore Kumar,Dance
Chak De,"Sadhana Sargam, Sonu Nigam",Dance
Sirf Tum,"Anuradha Paudwal, Hariharan",Dance
Chhaliya,"Piyush Mishra, Sunidhi Chauhan",
Dum Dum Diga Diga,Mukesh,Dance
Aankhon Ne Tumhari,"Alka Yagnik, Kumar Sanu",Romantic
Janam Janam,Atif Aslam,
Tanha Tanha,"Aditi Paul, Jubin Nautiyal",Romantic
Heer,"Mahalakshmi, Mika Singh",Romantic
Wat Wat Wat,"Arijit Singh, Shashwat Singh",Dance
Tanha Tanha Ghum Ke Dhunde Dil,"Aditi Paul, Jubin Nautiyal",Romantic
Pyar Ki Raahen,Shaan,Sad
Aap Ki Khatir,Himesh Reshammiya,Romantic
Saat Rang Mein Khel Rahi Hain,"Amit Kumar, Anuradha Paudwal",Dance
Jaadoo Jaadoo,"Adnan Sami, Alka Yagnik",Dance
Yaadon Mein,"Cuca Roseta, Jonita Gandhi, Mohammed Irfan",Sad
Dil Deewana Bin Sajna Ke,S.P. Balasubrahmanyam,Dance
Chori Chori Chupke Chupke,"Alka Yagnik, Babul Supriyo",Dance
Behene De,"Karthik, Mohammed Irfan",Dance
O Re Kanchi,"Alka Yagnik, Shaan",Dance
Rasiya,Shruti Pathak,Sensual
Meri Zindagi Ek Pyaas,"Jaspinder Narula, Shankar Mahadevan",Sad
Tum Jo Aaye,Rahat Fateh Ali Khan,Romantic
Laal Ishq,Arijit Singh,Sad
Tujhe Jeevan Ki Dor Se,"Lata Mangeshkar, Mohammed Rafi",Romantic
Aao Bachho Tumhe Dikhaye,Kavi Pradeep,Patriotic
Mujhse Mohabbat Ka,"Alka Yagnik, Kumar Sanu",Romantic
Mujhe Pyaar Hua,"Abhijeet, Alka Yagnik",Dance
Satarangi Re,"Kavita Krishnamurthy, Sonu Nigam",Dance
Mann Ki Lagan,Rahat Fateh Ali Khan,Sad
Dil Na Jaane Kyun,"Anushka Manchanda, Atif Aslam",Dance
Usne Bola Kem Che,"Bali Brahmbhatt, Sunidhi Chauhan",Dance
Sajna Ve Sajna,Sunidhi Chauhan,Dance
Mera Yaar,Javed Bashir,Romantic
Jiyein Kyun,Papon,Sad
Dil Ki Hai Tamanna,"Neha Bhasin, Shalini Singh, Vijay Prakash",Dance
Dum Duma Dum,"Anuradha Paudwal, Udit Narayan",Dance
Dil Chahta Hai,Shankar Mahadevan,Dance
Aai Pappi – Tu Hai Meri Soniye,Neeraj Shridhar,Dance
Where’s the Party Tonight,"Loy Mendonsa, Shaan, Shankar Mahadevan, Vasundhara Das",Dance
Prem Jaal Mein,"Anuradha Sriram, Sukhwinder Singh",DanceRomantic
Boi Boi,"Arun Bakshi, Vinod Rathod",Dance
Jeevan Se Bhari Teri Ankhen,Kishore Kumar,Romantic
Teri Pyari Pyari Soorat Ko,Mohammed Rafi,Romantic
Bas Ek Kinng,"Hard Kaur, Jaaved Jaffrey, Neeraj Shridhar",Dance
Jeena Yahan Marna Yahan,Mukesh,Sad
Banarasiya,"Anwesshaa, Meenal Jain, Shreya Ghoshal",Romantic
What’s Going On?,"Kunal Ganjawala, Sunidhi Chauhan",Dance
Aye Watan Aye Watan,"Jaspinder Narula, Sukhwinder Singh, Udit Narayan",Patriotic
Dulhan Hum Le Jayenge,"Alka Yagnik, Kumar Sanu, Sunita Rao",Romantic
Aa Bhi Ja Sanam,Atif Aslam,Sad
Salaam Namaste,"Kunal Ganjawala, Vasundhara Das",Dance
Mar Jaava,"Merchant, Shruti Pathak",Sensual
Koi Jaye To Le Aaye,"Alka Yagnik, Anu Malik, Shankar Mahadevan",Dance
Tumhi Dekho Naa,"Alka Yagnik, Sonu Nigam",Romantic
Sau Dard,"Sonu Nigam, Suzanne",Sad
Piya Milenge,Sukhwinder Singh,Sad
Chandan Sa Badan,Mukesh,Romantic
Kyun (Duet),"Shaan, Shreya Ghoshal",Sad
Alcoholic,Yo Yo Honey Singh,Dance
Jis Gali Mein Tera Ghar,Mukesh,Romantic
Kurbaan Hua,Vishal Dadlani,Dance
Nagada Nagada,"Javed Ali, Sonu Nigam",Dance
Main Tujhse Pyaar Nahin Karta,Papon,Sad
Ishq Tera,"Shreya Ghoshal, Sonu Nigam",Romantic
Oh Jaaniya,"Raj Pandit, Salim Merchant, Shreya Ghoshal",Romantic
Jab Kisiki Taraf Dil,Kumar Sanu,Romantic
Aye Meri Zindagi – Male Version,"Shreya Ghoshal, Udit Narayan",Sad
Jiya Lage Na,"Ravindra Upadhyay, Sona Mohapatra",Romantic
Paas Woh Aane Lage,"Alka Yagnik, Kumar Sanu",Romantic
Jaane Tere Shehar Ka,Vipin Aneja,
Pee Paa Pee Paa,Diljit Dosanjh,Dance
Ada,Sonu Nigam,Dance
Chupke Chupke Ghoor Na Mujhko,"Anu Malik, Udit Narayan, Vinod Rathod",
Pag Ghungaru Bandh,Kishore Kumar,Dance
Dekho Zara Kaise Balkhake Chali,Gurdas Maan,Dance
Aap Ki Kashish,Himesh Reshammiya,Romantic
Happy Budday,"Shankar Mahadevan, Sukhwinder Singh",Dance
Hudd Hudd Dabangg,"Sukhwinder Singh, Wajid",Dance
Bhool Bhulaiyaa,Neeraj Shridhar,Dance
Tere Mast Mast Do Nain,"Rahat Fateh Ali Khan, Shreya Ghoshal",Romantic
Jai Ho Tiltle Song,"Armaan Malik, Wajid",Dance
High Heels Te Nachche (Remix),"Aditi Singh Sharma, Jaz Dhami, Meet Bros",Dance
Zinda,Sunidhi Chauhan,
Shukran Allah,"Salim Merchant, Shreya Ghoshal, Sonu Nigam",Romantic
Tere Naina,"Shankar Mahadevan, Shreya Ghoshal",Romantic
Mere Mehboob Qayamat Hogi,Kishore Kumar,Sad
Saad Shukrana,Ankit Tiwari,Romantic
Honeymoon Ki Raat,Sunidhi Chauhan,Dance
Sadda Dil Vi Tu,Hard Kaur,Dance
Yeh Jo Halki Halki Khumariya,Rahat Fateh Ali Khan,Romantic
Aye Khuda,"Kshitij Tarey, Mithoon, Saim Bhat",Sad
Main Hoon Na,Abhijeet,Sad
Hum To Tere Aashiq Hain,"Lata Mangeshkar, Mukesh",Romantic
Jugnu Ki Payal,"Shaswati, Zubeen Garg",Dance
Woh Ladki Bahut Yaad Aati,"Alka Yagnik, Kumar Sanu",
Jai Mata Di,"Alamgir Khan, Javed Ali",Devotional
Mera Piya Ghar Aaya,Kavita Krishnamurthy,Dance
Khushiyon Ka Din Aaya Hai,Anuradha Paudwal,Dance
Sooraj Ki Baahon Mein,"Clinton Cerejo, D Cerejo, Loy Mendonsa",Dance
Kuch Toh Hua Hai,Ankit Tiwari,Romantic
Rabba Main Toh Mar Gaya Oye,Shahid Mallya,Romantic
Theher Ja (Remix),Armaan Malik,Romantic
Jiya Maine Jiya,"Alka Yagnik, Udit Narayan",Romantic
Kuch To Hua Hai,"Alka Yagnik, Shaan",Dance
Angelina,Sonu Nigam,Romantic
Dhoom Again,"Dominique Crezo, Vishal Dadlani",Dance
Dhinka Chika (Remix),"Amrita Kak, Mika Singh",Dance
Tu Milade,Ankit Tiwari,Dance
Thoda Thoda Pyar,Sunidhi Chauhan,Dance
O Mere Raja,"Asha Bhosle, Kishore Kumar",Dance
Gela Gela Gela,"Adnan Sami, Sunidhi Chauhan",Dance
Ik Tu Hi Tu Hi,Hans Raj Hans,Devotional
Sultan (Mashup),Multiple,Dance
Kitni Hasrat Hain Humein,"Kumar Sanu, Sadhana Sargam",Romantic
Aa Jaana Aa Jaana,"Alka Yagnik, Kumar Sanu",Romantic
Har Dil Jo Pyar Karega,"Lata Mangeshkar, Mahendra Kapoor, Mukesh",Dance
Har Dil Jo Pyar Karega,"Lata Mangeshkar, Mahendra Kapoor, Mukesh",Dance
Morey Piya,Udit Narayan,Romantic
Kate Nahin Kat Te,"Alisha Chinai, Kishore Kumar",Romantic
Tu,Kumar Sanu,
Mujhse Huee Bas Yeh,Alka Yagnik,Sad
Nakhriley,"Ali Zafar, Gulzar, Mahalakshmi Iyer, Shankar Mahadevan",Dance
Tandoori Nights,"Himesh Reshammiya, Sunidhi Chauhan",Dance
Kya Raaz Hai,"Shreya Ghoshal, Zubeen Garg",Dance
Tum Toh Dhokabaaz Ho,"Alka Yagnik, Kumar Sanu",
Lucky Boy,"Hard Kaur, Raja Hassan, Sunidhi Chauhan",Dance
Aye Manya,"Adnan Sami, Shaan",Dance
Ladki Hai Ya Shola,"Kishore Kumar, Lata Mangeshkar",Dance
Yeh Mera Dil Yaar Ka Diwana,Asha Bhosle,Dance
Babuji Zara Dheere Chalo,Sonu Kakkar,Dance
Aankhon Aankhon (Remix),Yo Yo Honey Singh,Dance
Ek Duje Ke Vaaste,"Hariharan, Lata Mangeshkar",Romantic
Hey Ya I See You Walking,"Loy Mendonsa, Shankar Mahadevan",Dance
More Haji Piya,Amjad Farid Sabri,Devotional
Tere Mere Beech Mein,"Mohit Chauhan, Sunidhi Chauhan",Romantic
Ye Ladki Nahin Banaras Ka Paan,"Bela Sulakhe, Sonu Nigam",Dance
Kai Baar Yun Bhi Dekha Hai,Mukesh,Romantic
Pakeezah,Gulraj Singh,
Dam Bhar Jo Udhar Munh Phere,"Lata Mangeshkar, Mukesh",Dance
Bade Armanon Se,"Lata Mangeshkar, Mukesh",Dance
Challa Chaap Chunariya,Rekha Bhardwaj,
Chal Akela Chal Akela,Mukesh,Dance
De De Pyaar De,Kishore Kumar,Dance
Behti Hawa Sa Tha Woh,"Shaan, Shantanu Moitra",Sad
Dil Ye Dancer Ho Gaya,Atif Aslam,
Mor Bani Thanghat Kare,"Aditi Paul, Osman Mir",Dance
Gore Gore Se,Alka Yagnik,Dance
Sanam Teri Kasam (Reprise),"Mohammed Irfan, Palak Muchhal",Sad
School Ke Din,Sonu Nigam,Dance
Yeh Mera Prem Patra,Mohammed Rafi,Romantic
Jiska Koi Nahin,Manna Dey,Motivational
Chalo Ek Bar Phir Se,Mahendra Kapoor,Sad
Kab Ke Bichhde Hue,"Asha Bhosle, Kishore Kumar",Romantic
Aaj Ibaadat,"Altamash Faridi, Javed Bashir, Shadab Faridi, Shashi Suman, Shreyas Puranik",Devotional
