Song-Name,Singer/Artists,Genre
Aankh Marey,"Kumar Sanu, Mika Singh, Neha Kakkar",Dance
Coca Cola,"Neha Kakkar, Tony Kakkar",DanceRomantic
Apna Time Aayega,Ranveer Singh,Dance
Mungda,"Jyotica Tangri, Shaan, Subhro Ganguly",Dance
Tere Bin,"Asees Kaur, Rahat Fateh Ali Khan, Tanishk Bagchi",Romantic
Gali Gali,Neha Kakkar,Dance
Chamma Chamma,"Arun, Ikka, Neha Kakkar, Romy",Dance
Mere Gully Mein,Ranveer Singh,Dance
Kamariya,Darshan Raval,Dance
Ek Ladki Ko Dekha Toh Aisa Laga,"Darshan Raval, Rochak Kohli",Romantic
Swag Se Swagat,"Neha Bhasin, Vishal Dadlani",Dance
Poster Lagwa Do,"Mika Singh, Sunanda Sharma",Dance
Daaru Wargi,Guru Randhawa,Dance
Dilbar,"Dhvani Bhanushali, Ikka, Neha Kakkar",Dance
Proper Patola,"Aastha Gill, Badshah, Diljit Dosanjh",Dance
Doori,Ranveer Singh,Dance
Dil Diyan Gallan,Atif Aslam,Romantic
Husn Parcham,"Bhoomi Trivedi, Raja Kumari",Dance
Bom Diggy Diggy,"Jasmin Walia, Zack Knight",Dance
Issaqbaazi,"Divya Kumar, Sukhwinder Singh",Dance
Mere Naam Tu,Abhay Jodhpurkar,Romantic
High Rated Gabru – Nawabzaade,Guru Randhawa,Dance
Dekhte Dekhte,Atif Aslam,Romantic
Zingaat,"Ajay, Atul",Dance
Tareefan,Badshah,
Mile Ho Tum (Reprise),"Neha Kakkar, Tony Kakkar",Romantic
Dil Chori,"Ishers, Simar Kaur, Yo Yo Honey Singh",Dance
Tere Naal Nachna,"Badshah, Sunanda Sharma",Dance
Dil Meri Na Sune,Atif Aslam,Romantic
Dhadak Title Track,"Ajay Gogavale, Shreya Ghoshal",Romantic
Heeriye,"Deep Money, Meet Bros, Neha Bhasin",DanceRomantic
Chogada,"Asees Kaur, Darshan Raval",Dance
Gud Naal Ishq Mitha,"Harshdeep Kaur, Navraj Hans",Dance
Paniyon Sa,"Atif Aslam, Tulsi Kumar",Romantic
Milegi Milegi,Mika Singh,Dance
Morni Banke,"Guru Randhawa, Neha Kakkar",Dance
Bhare Bazaar,"B Praak, Badshah, Payal Dev, Vishal Dadlani",Dance
Khalibali,Shivam Pathak,Dance
Aao Kabhi Haveli Pe,"Badshah, Jigar, Nikhita Gandhi, Sachin Sanghvi",Dance
Badri Ki Dulhania,"Dev Negi, Ikka, Monali Thakur, Neha Kakkar",Dance
Cheez Badi,"Neha Kakkar, Udit Narayan",Dance
Dholida,"Neha Kakkar, Palak Muchchal, Raja Hassan, Udit Narayan",Dance
Sweetheart,Dev Negi,Dance
Namo Namo,Amit Trivedi,Devotional
Qaafirana,"Arijit Singh, Nikhita Gandhi",Romantic
Tu Hi Re,"Armaan Malik, Shashaa Tirupati",Dance
Chhote Chhote Peg,"Navraj Hans, Neha Kakkar, Yo Yo Honey Singh",Dance
Galti Se Mistake,"Amit Mishra, Arijit Singh",Dance
Phir Mulaaqat,Jubin Nautiyal,Romantic
Kala Chashma,"Amar Arshi, Badshah, Neha Kakkar",Dance
Mantoiyat,Raftaar,
Nashe Si Chadh Gayi,Arijit Singh,Dance
Mera Pyar Tera Pyar,Arijit Singh,RomanticSad
Ding Dang,"Amit Mishra, Antara Mitra",Dance
Main Tera Boyfriend,"Arijit Singh, Meet Bros, Neha Kakkar",Dance
Laila Main Laila,Pawni Pandey,Dance
Ghoomar,"Shreya Ghoshal, Swaroop Khan",Dance
Rafta Rafta Medley,"Akash Ojha, Disha Sharma, Jordi Patel, Rekha, Sonakshi Sinha, Vishal Mishra",Dance
Pal,"Arijit Singh, Shreya Ghoshal",Romantic
Patola,Guru Randhawa,Dance
Pallo Latke,"Fazilpuria, Jyotica Tangri, Yasser Desai",Dance
Main Badhiya Tu Bhi Badhiya,"Sonu Nigam, Sunidhi Chauhan",
Billionaire,"Simar Kaur, Singhsta, Yo Yo Honey Singh",Dance
This Party Is Over Now,Yo Yo Honey Singh,Dance
Heer Badnaam,Romy,DanceSad
Tera Hua,Atif Aslam,Romantic
Jaan Nisaar,Arijit Singh,Romantic
Akh Lad Jaaye,"Asees Kaur, Badshah, Jubin Nautiyal",DanceRomantic
Rangtaari,"Dev Negi, Yo Yo Honey Singh",Dance
The Humma Song,"Badshah, Jubin Nautiyal, Shashaa Tirupati",Dance
Pehli Baar,Ajay Gogavale,Romantic
Tera Yaar Hoon Main,Arijit Singh,RomanticSad
Dilbaro,"Harshdeep Kaur, Shankar Mahadevan, Vibha Saraf",
Chhod Diya,Arijit Singh,Sad
Maine Tujhko Dekha,"Neeraj Shridhar, Sukriti Kakar",Dance
Allah Duhai Hai,"Amit Mishra, Jonita Gandhi, Sreerama Chandra",Dance
Cham Cham,Monali Thakur,Dance
Kar Har Maidaan Fateh,"Shreya Ghoshal, Sukhwinder Singh",Motivational
Kamariya,"Aastha Gill, Divya Kumar, Jigar Saraiya, Sachin Sanghvi",Dance
Tamma Tamma Again,"Anuradha Paudwal, Badshah, Bappi Lahiri",Dance
Tera Fitoor,Arijit Singh,Romantic
Mere Rashke Qamar,"Nusrat Fateh Ali Khan, Rahat Fateh Ali Khan",Romantic
The Breakup Song,"Arijit Singh, Badshah, Jonita Gandhi, Nakash Aziz",Dance
Naino Ne Bandhi,Yasser Desai,Romantic
Sanu Ek Pal Chain,Rahat Fateh Ali Khan,Romantic
Ban Ja Rani,Guru Randhawa,DanceRomantic
Zaalima,"Arijit Singh, Harshdeep Kaur",DanceRomantic
Baarish,"Ash King, Shashaa Tirupati",Romantic
Aashiq Banaya Aapne,"Himesh Reshammiya, Neha Kakkar",Dance
Ek Do Teen Song,Shreya Ghoshal,Dance
Tere Liye,"Akanksha Bhandari, Atif Aslam",Romantic
Nazam Nazam,"Arko, Ayushman Khurana",Romance
Good Morning,"Shannon Donald, Vishal Dadlani",
O Saathi,"Atif Aslam, Payal Dev",Romantic
Tere Jaisa,"Arko, Tulsi Kumar",Romantic
Mera Intkam Dekhegi,Krishna Beuraa,Sad
Gerua,"Antara Mitra, Arijit Singh",Romantic
Suraiyya,"Shreya Ghoshal, Vishal Dadlani",Dance
Gold Tamba,Nakash Aziz,Dance
Ae Dil Hai Mushkil,Arijit Singh,Sad
Prem Ratan Dhan Payo,Palak Muchhal,DanceRomantic
Mohabbat,Sunidhi Chauhan,Dance
Nainowale Ne,Neeti Mohan,Romantic
Mummy Kasam,"Gurinder Seagal, Payal Dev",Dance
Nasha,Amit Gupta,Sensual
Bulleya,"Amit Mishra, Shilpa Rao",DanceSad
Kar Gayi Chull,"Badshah, Fazilpuria, Neha Kakkar, Sukriti Kakar",Dance
Musafir,"Atif Aslam, Palak Muchhal",Sad
Binte Dil,Arijit Singh,Dance
Halka Halka,"Divya Kumar, Sunidhi Chauhan",Romantic
Humsafar,"Akhil Sachdeva, Mansheel Gujral",RomanticSad
Chad Gayi Hai,"Jigar, Sachin Sanghvi, Vishal Dadlani",Dance
Tum Mere Ho,"Amrita Singh, Jubin Nautiyal",Sensual
Bole Chudiyan,"Alka Yagnik, Amit Kumar, Kavita Krishnamurthy, Sonu Nigam, Udit Narayan",DanceRomantic
Sawarne Lage,Jubin Nautiyal,Romantic
Chalti Hai Kya 9 Se 12,"Dev Negi, Neha Kakkar",Dance
Selfish,"Atif Aslam, Iulia Vantur",Romantic
Oonchi Hai Building,"Anu Malik, Neha Kakkar",Dance
Shikwa Nahin Kisi Se,Kumar Sanu,Sad
Sanam Re,Arijit Singh,Romantic
Dekha Hai Pehli Baar,"Alka Yagnik, S.P. Balasubrahmanyam",Dance
Phir Bhi Tumko Chaahunga,"Arijit Singh, Shashaa Tirupati",Sad
Suit Suit,"Arjun, Guru Randhawa",Dance
Nachange Saari Raat,"Meet Bros, Neeraj Shridhar, Tulsi Kumar",Dance
Ishq Di Baajiyan,Diljit Dosanjh,Romantic
Hard Hard,"Mika Singh, Prakriti Kakar, Sachet Tandon",Dance
Udi Udi Jaye,"Bhoomi Trivedi, Karsan Sagathia, Sukhwinder Singh",Dance
Nazar Na Lag Jaaye,"Ash King, Jigar, Sachin Sanghvi",Romantic
Nachle Na,"Guru Randhawa, Neeti Mohan",Dance
Hatt Ja Tau,Sunidhi Chauhan,Dance
Chittiyaan Kalaiyaan,"Anjjan, Kanika Kapoor, Meet Bros",Dance
La La La (Baazaar),"Bilal Saeed, Neha Kakkar",DanceRomantic
Tujhse Kahan Judaa Hoon Main,"Himesh Reshammiya, Neeti Mohan, Vineet Singh",Sad
Hua Hain Aaj Pehli Baar,"Armaan Malik, Palak Muchhal",Romantic
Jay-Jaykara,Kailash Kher,Sad
Tu Hi Hai,Rahul Mishra,
Hawa Hawa,"Mika Singh, Prakriti Kakkar",Dance
Bhangra Ta Sajda,"Neha Kakkar, Romy, Shashwat Sachdev, Surya Ragunaathan",Dance
Deewani Mastani,"Ganesh Chandanshive, Shreya Ghoshal",Dance
O Meri Laila,"Atif Aslam, Jyotica Tangri",Romantic
Lo Safar,Jubin Nautiyal,Romantic
Chalte Chalte,Atif Aslam,Romantic
Party Chale On,"Iulia Vantur, Mika Singh",Dance
Sweety Tera Drama,"Dev Negi, Pawni Pandey, Shraddha Pandit",Dance
Ek Dil Ek Jaan,Shivam Pathak,Romantic
Ae Watan,Arijit Singh,Patriotic
Sunn Le Zara,Arnab Dutta,Sad
Naam Hai Mera,Neeti Mohan,RomanticSad
Jiyo Re Baahubali,"Daler Mehndi, Ramya Behara, Sanjeev Chimmalgi",Dance
Soniye Dil Nayi,"Ankit Tiwari, Shruti Pathak",RomanticSad
Mundiyan,"Navraj Hans, Palak Muchhal",Dance
Chitthi Aai Hai,Pankaj Udhas,Sad
Hawayein,Arijit Singh,Romantic
Channa Mereya,Arijit Singh,Sad
Lag Ja Gale,Jonita Gandhi,Romantic
Sleepy Sleepy Akiyaan,"Asees Kaur, Yasser Desai",Dance
Subah Subah,"Amaal Mallik, Arijit Singh, Prakriti Kakkar",Dance
Naina Da Kya Kasoor,Amit Trivedi,Romantic
Soorma Anthem,Shankar Mahadevan,Motivational
Agar Tum Saath Ho,"Alka Yagnik, Arijit Singh",Sad
Tum Se,Jubin Nautiyal,RomanticSad
Kem Cho,"Ikka, Jyotica Tangri",Dance
Aaj Se Teri,Arijit Singh,Romantic
Maana Ke Hum Yaar Nahin,Parineeti Chopra,Romantic
Nain Na Jodeen,"Ayushmann Khurrana, Neha Kakkar, Rochak Kohli",RomanticSad
Wajah Tum Ho,"Altamash Faridi, Mithoon, Tulsi Kumar",RomanticSadSensual
Pyaar De,Ankit Tiwari,Romantic
Ik Vaari Aa,Arijit Singh,Romantic
Radha,"Shekhar Ravjiani, Shreya Ghoshal, Udit Narayan, Vishal Dadlani",Dance
Mehbooba,"Mohammed Rafi, Neha Kakkar, Yasser Desai",Dance
Hamari Adhuri Kahani,Arijit Singh,Sad
Tere Sang Yaara,Atif Aslam,Romantic
Radha,"Shahid Mallya, Sunidhi Chauhan",Romantic
Kamli,Sunidhi Chauhan,Dance
Maiya Yashoda,"Alka Yagnik, Anuradha Paudwal, Kavita Krishnamurthy",Dance
Lae Dooba,Sunidhi Chauhan,Sad
Abhi Toh Party Shuru Hui Hai,"Aastha Gill, Badshah",Dance
Hello Hello,Rekha Bhardwaj,Dance
Bola Har Har Har,"Aaman Trikha, Badshah, Sukhwinder Singh",Devotional
Bolo Har Har Har,"Anugrah, Badshah, Megha Sriram Dalton, Mithoon, Mohit Chauhan, Sukhwinder Singh",Dance
Tera Mera Rishta,"KK, Shreya Ghoshal",Romantic
Gal Ban Gayi,"Meet Bros, Neha Kakkar, Sukhbir Singh, Yo Yo Honey Singh",Dance
Bol Do Na Zara,Armaan Malik,Romantic
Lakk Mera Hit,"Mannat Noor, Rochak Kohli, Sukriti Kakar",Dance
Sexy Baliye,Mika Singh,Dance
Main Jahaan Rahoon,Rahat Fateh Ali Khan,Sad
Hasi Ban Gaye,Shreya Ghoshal,Romantic
Nachde Ne Saare,"Harshdeep Kaur, Jasleen Royal, Siddharth Mahadevan",Dance
Manma Emotion Jaage,"Amit Mishra, Antara Mitra, Anushka Manchanda",DanceRomantic
Happy Happy,"Aastha Gill, Badshah",
Tujhko Na Dekhun,"Sunidhi Chauhan, Udit Narayan",
Theher Ja,Armaan Malik,Romantic
Boond Boond,"Jubin Nautiyal, Neeti Mohan",Romantic
Adhura Lafz,"Pratibha Singh Baghel, Rahat Fateh Ali Khan",Romantic
Trippy Trippy,"Badshah, Benny Dayal, Brijesh Shandilya, Neha Kakkar",Dance
Tukur Tukur,"Arijit Singh, Kanika Kapoor, Nakash Aziz, Neha Kakkar, Siddharth Mahadevan",Dance
Teri Khair Mangdi,Bilal Saeed,Sad
Pinga,"Shreya Ghoshal, Vasihali Made",Dance
Haanikaarak,Sarwar Khan,
Tere Thumke Sapna Chaudhary,"Gunwant Sen, Khushboo Jain, Saumya Upadhyay",Dance
Badnaamiyan,Armaan Malik,Romantic
Malhari,Vishal Dadlani,Dance
Piya More,"Mika Singh, Neeti Mohan",
High Heels Te Nachche,"Aditi Singh Sharma, Jaz Dhami, Meet Bros",Dance
Shake Karaan,"Kanika Kapoor, Meet Bros",Dance
Thodi Der,"Farhan Saeed, Shreya Ghoshal",Sad
Har Dil Jo Pyar Karega,"Alka Yagnik, Udit Narayan",Dance
Raabta,Nikhita Gandhi,Romantic
Nach Meri Jaan,"Dev Negi, Kamaal khan, Nakash Aziz, Tushar Joshi",Dance
Janam Janam,"Antara Mitra, Arijit Singh",Romantic
Andha Dhun,Raftaar,Dance
Holi Biraj Ma,Jubin Nautiyal,Dance
Kal Ho Naa Ho Title Track,Sonu Nigam,Sad
Enna Sona,"A.R. Rahman, Arijit Singh",Romantic
Little Little,Harrdy Sandhu,Dance
Maa Sherawaliye,Sonu Nigam,
Disco Disco,"Benny Dayal, Shirley Setia",Dance
Lambiyaan Si Judaiyaan,"Altamash Faridi, Arijit Singh, Shadaab Faridi",Sad
Aahista,"Arijit Singh, Jonita Gandhi",Romantic
Naam Hai Bhaiaji,"Amit Mishra, Raftaar",
Kisi Se Tum Pyaar Karo,"Alka Yagnik, Kumar Sanu",Romantic
Naam Hai Bhaiaji,"Amit Mishra, Raftaar",
Baba Bolta Hain Bas Ho Gaya,"Papon, Ranbir Kapoor, Supriya Pathak",
Sultan Title Song,"Shadaab Faridi, Sukhwinder Singh",Motivational
Radio,"Amit Mishra, Kamaal khan",Dance
Sab Badhiya Hai,Sukhwinder Singh,Dance
Chin Chin Chu,"Jassi Gill, Sonakshi Sinha",Dance
Beat Pe Booty,"Jigar Saraiya, Kanika Kapoor, Sachin Sanghvi, Vayu",Dance
Jag Ghoomeya,Rahat Fateh Ali Khan,Romantic
Jogi,"Aakanksha Sharma, Yasser Desai",Romantic
Lets Nacho,"Badshah, Benny Dayal",Dance
Tu Tu Hai Wahi,"Asha Bhosle, Kishore Kumar",Romantic
Yeh Vaada Raha,"Asha Bhosle, Kishore Kumar",Dance
Vande Mataram,"Badshah, Daler Mehndi, Divya Kumar, Tanishka Sanghvi",Dance
Jeene Laga Hoon,Atif Aslam,Romantic
Nit Khair Manga,Rahat Fateh Ali Khan,Romantic
Jitni Dafa,"Jeet Gannguli, Yasser Desai",Romantic
Wajah Tum Ho,Armaan Malik,RomanticSensual
Rozana,Shreya Ghoshal,Romantic
Tu Meri Main Tera,"Altamash Faridi, Rahat Fateh Ali Khan, Shadab Faridi",RomanticSad
Gallan Goodiyaan,"Farhan Akhtar, Manish Kumar Tipu, Shankar Mahadevan, Sukhwinder Singh, Yashita Sharma",Dance
Swag Se Swagat (Arabic),"Brigitte Yaghi, Neha Bhasin, Rabih Baroud, Vishal Dadlani",Dance
Kudiya Shehar Diyan,"Daler Mehndi, Neha Kakkar",Dance
Kudiya Shehar Diyan,"Daler Mehndi, Neha Kakkar",Dance
Aap Se Milkar,"Aakanksha Sharma, Ayushmann Khurrana",Romantic
Socha Hai,"Jubin Nautiyal, Neeti Mohan",Romantic
Sawan Aaya Hai (Unplugged Version),"Neha Kakkar, Tony Kakkar",Sad
Pehle Ke Jaisa,K.K.,Sad
Main Woh Chaand,Darshan Raval,RomanticSad
Ankhiyon Se Goli Mare,"Jaspinder Narula, Sonu Nigam",Dance
Jab Tak,"Amaal Mallik, Armaan Malik",Romantic
Luv Letter,"Kanika Kapoor, Meet Bros",Dance
Ullu ka Pattha,"Arijit Singh, Nikhita Gandhi",
Yaad Hai Na,Arijit Singh,Romantic
Balma,"Rekha Bhardwaj, Sunidhi Chauhan",Dance
Kisi Se Pyar Ho Jaye,Jubin Nautiyal,DanceRomantic
Sau Aasmaan,"Armaan Malik, Neeti Mohan",Dance
Beparwah,"Nandini Deb, Siddharth Basrur",Dance
Yaad Hai,"Ankit Tiwari, Palak Muchhal",Sad
Dhayaan Chand,"Amit Trivedi, Nikhita Gandhi, Suhas Sawant, Vijay Yamla",Dance
Aaj Zid,Arijit Singh,Sensual
Hum Pyaar Hai Tumhare,"Alka Yagnik, Kumar Sanu",Romantic
Main Hoon,Siddharth Mahadevan,Dance
Swag Saha Nahi Jaye,"Neha Bhasin, Shadab Faridi, Sohail Sen",Dance
Chote Bade,"Ankit Tiwari, Mika Singh",Dance
Main Hoon Saath Tere,Arijit Singh,Romantic
Kabira,"Rekha Bhardwaj, Tochi Raina",Sad
Main Kaun Hoon,Meghna Mishra,Sad
Aashiq Surrender Hua,"Amaal Mallik, Shreya Ghoshal",Dance
Nachan Farrate,"Kanika Kapoor, Meet Bros",Dance
Pyar De Pyar Le,"Dev Negi, Ikka, Iulia Vantur",Dance
Do Peg Maar,Neha Kakkar,Dance
Tera Noor,Jyoti Nooran,
Jaanu,"Juggy D, Raftaar, Shivi",Dance
Hamdard,Arijit Singh,Romantic
Hawa Hawai 2.0,"Kavita Krishnamurthy, Shashaa Tirupati",Dance
Dhoom Dhadakka,"Antara Mitra, Shahid Mallya",Dance
Lovely,"Fateh, Kanika Kapoor, Miraya Varma, Ravindra Upadhyay",Dance
Mohabbat Nasha Hai,"Neha Kakkar, Tony Kakkar",Sad
Chal Wahan Jaate Hain,Arijit Singh,Romantic
Ishq De Fanniyar,Jyotica Tangri,Romantic
Palat Tera Hero Idhar Hai,Arijit Singh,DanceRomantic
Tab Bhi Tu,Rahat Fateh Ali Khan,Sad
Yeh Ladka Hai Allah,"Alka Yadnik, Udit Narayan",Dance
Tujhe Yaad Na Meri Aayee,"Alka Yagnik, Manpreet Akhtar, Udit Narayan",Sad
Jalte Diye,"Anwesshaa, Harshdeep Kaur, Shabab Sabri, Vineet Singh",Romantic
Zindagi Bana Loon,Palak Muchhal,Romantic
Humnava,Papon,Sad
Galliyan,Ankit Tiwari,Romantic
Tere Chehre Mein Woh Jaadu Hai,Kishore Kumar,Romantic
Golmaal Again Title Track,"Aditi Singh Sharma, Brijesh Shandilya",Dance
Suno Ganpati Bappa Morya,Amit Mishra,Dance
Dil Dene Ki Ruth,"Alka Yagnik, Vinod Rathod",Dance
Soch Na Sake,"Amaal Mallik, Arijit Singh, Tulsi Kumar",Romantic
Tu Meri,Vishal Dadlani,DanceRomantic
Baby Ko Bass Pasand Hai,"Badshah, Ishita, Shalmali Kholgade, Vishal Dadlani",Dance
Daddy Mummy,"Devi Sri Prasad, M. M. Manasi",Dance
Dekha Hazaro Dafaa,"Arijit Singh, Palak Muchhal",Romantic
Khatar Patar,Papon,Dance
Tu Mera Bhai Nahi Hai,"Gandhharv Sachdeav, Raftaar",
Party With The Bhoothnath,Yo Yo Honey Singh,Dance
Hasi,Ami Mishra,RomanticSad
Good Man Di Laaltein,"Sukhwinder Singh, Sunidhi Chauhan",Dance
Kaabil Hoon,"Jubin Nautiyal, Palak Muchhal",Romantic
Manali Trance,"Neha Kakkar, Yo Yo Honey Singh",Dance
Main Teri Dushman Dushman Tu,Lata Mangeshkar,Dance
Hafiz Hafiz,Mohit Chauhan,Romantic
Tere Jaisa Yaar Kahan,Kishore Kumar,
Daryaa,"Ammy Virk, Shahid Mallya",Sad
Chota Sa Fasana,Arijit Singh,
Main Adhoora,"Aakanksha Sharma, Yasser Desai",Sad
Aao Raja,"Neha Kakkar, Yo Yo Honey Singh",Dance
Haseeno Ka Deewana,"Payal Dev, Raftaar",Dance
Swag,"Brijesh Shandaliya, Pranaay",Dance
Ki Kariye Nachna Aaonda Nahin,"Hardy Sandhu, Neha Kakkar, Raftaar",Dance
Neele Neele Ambar par,Kishore Kumar,Dance
Choli Ke Peeche Kya Hai (Female),"Alka Yagnik, Vinod Rathod",Dance
Kitna Haseen Chehra,Kumar Sanu,Romantic
Girl I Need You,"Arijit Singh, Roach Killa",Romantic
Sanam Teri Kasam,Ankit Tiwari,Romantic
Kisi Din Banoongi Main,"Alka Yagnik, Udit Narayan",Dance
Laaj Sharam,"Divya Kumar, Enbee, Jasleen Royal",
Badan Pe Sitaare,Sonu Nigam,DanceRomantic
Menu Kehn De,Himesh Reshammiya,Sad
Bekhudi,"Aditi Singh Sharma, Darshan Raval",Romantic
Kun Faya Kun,"A.R. Rahman, Javed Ali, Mohit Chauhan",Dance
Balam Pichkari,"Shalmali Kholgade, Vishal Dadlani",Dance
Tinka Tinka Dil Mera,Rahat Fateh Ali Khan,Sad
Jaana Ve,Arijit Singh,Romantic
Shubh Din,"Keerthi Sagathia, Yotica Tangri",
The Disco Song,"Benny Dayal, Nazia Hassan, Sunidhi Chauhan",Dance
Nagada Sang Dhol,"Osman Mir, Shreya Ghoshal",Dance
Tune Mari Entriyaan,"Bappi Lahiri, K.K., Neeti Mohan, Vishal Dadlani",Dance
Ijazat,"Arijit Singh, Meet Bros",RomanticSensual
Tujhse Naaraz Nahi Zindagi,Anup Ghoshal,Sad
Pyar Kabhi Kam Nahi Karna,"Asha Bhosle, Bappi Lahiri",Romantic
Chikni Chameli,Shreya Ghoshal,Dance
Zaroorat,Mustafa Zahid,Sad
Bang Bang,"Benny Dayal, Neeti Mohan",Dance
Bulleya,Papon,Romantic
Barso Re,Shreya Ghoshal,Dance
Manwa Laage,"Arijit Singh, Shreya Ghoshal",Romantic
The Google Song,"Amaal Mallik, Armaan Malik, Neeti Mohan, Sonu Nigam, Tulsi Kumar",Dance
Ek Mulaqat,Jubin Nautiyal,RomanticSad
Suraj Hua Maddham,"Alka Yagnik, Sonu Nigam",
Aa Toh Sahii,"Meet Bros, Neha Kakkar",Dance
Nazm Nazm,Arko,Romantic
Teri Ore,"Rahat Fateh Ali Khan, Shreya Ghoshal",Romantic
Toota Jo Kabhi Tara,"Atif Aslam, Sumedha Karmahe",Sad
Say “Shava Shava”,"Aadesh, Alka Yagnik, Amitabh Bachchan, Sudesh Bhosle, Sunidhi Chauhan",Dance
Sunn Raha Hai (Male),Ankit Tiwari,Sad
Tu Banja Gali Benaras Ki,Asit Tripathy,Romantic
Khuda Bhi,Mohit Chauhan,Romantic
Chaar Botal Vodka,Yo Yo Honey Singh,Dance
Chaar Botal Vodka,Yo Yo Honey Singh,Dance
Selfie Le Le Re,"Badshah, Nakash Aziz, Pritam, Vishal Dadlani",Dance
India Wale,"K.K., Neeti Mohan, Shankar Mahadevan, Vishal Dadlani",Dance
Kudi Gujarat Di,"Akasa Singh, Jasbir Jassi, Sonia Sharma",Dance
Lag Ja Gale,Rahat Fateh Ali Khan,Romantic
O O Jaane Jaana,Kamaal khan,Dance
Fevicol Se,"Keerthi Sagathia, Mamta Sharma, Shadab Faridi, Uvie, Wajid",Dance
Tishnagi,"Dev Negi, Sunidhi Chauhan",Sensual
Saiyaara,"Mohit Chauhan, Tarannum Malik",Sad
Jab Mehndi Lag Lag Jaave,"Shreya Ghoshal, Sonu Nigam",Dance
Tu Jo Mila,K.K.,
Baarish (Atif Aslam),Atif Aslam,Romantic
Akkad Bakkad,"Badshah, Neha Kakkar",Dance
Tum Ho Toh Lagta Hai,Shaan,Romantic
Kya Khoob Lagti Ho,,Dance
Kya Khoob Lagti Ho,"Kanchan, Mukesh",Romantic
Saturday,"Akriti Kakar, Badshah, Indeep Bakshi",Dance
Dard Karaara,"Kumar Sanu, Sadhana Sargam",Romantic
Akhiyaan Milaoon Kabhi,"Alka Yagnik, Udit Narayan",Dance
Mere Humsafar,"Mithoon, Tulsi Kumar",Sad
Hangover,"Anjjan, Meet Bros, Salman Khan, Shreya Ghoshal",Romantic
Mind Blowing,Mika Singh,Dance
Jaaneman Aah,"Aaman Trikha, Antara Mitra",Dance
Dangal,Daler Mehndi,Motivational
Jag Ghoomeya (Female),Neha Bhasin,Romantic
Madamiyan,"Mamta Sharma, Mika Singh",Dance
Hum Nahi Sudhrenge,Armaan Malik,Dance
Aye Watan Tere Liye,"Kavita Krishnamurthy, Mohammad Aziz",Patriotic
Tu Hai,"A.R. Rahman, Sanah Moidutty",Romantic
Likhne Wale Ne Likh Dale,"Lata Mangeshkar, Suresh Wadkar",Dance
Duniya Bananewale,Mukesh,Sad
Bum Bum Bole,Shaan,Dance
Hans Mat Pagli,"Shreya Ghoshal, Sonu Nigam",Romantic
Butterfly,"Aaman Trikha, Dev Negi, Jyoti Nooran, Sultana Nooran, Sunidhi Chauhan",Dance
Nayak Nahi Khalnayak Hoon Main,"Kavita Krishnamurthy, Vinod Rathod",Dance
Saree Ke Fall Sa,"Antara Mitra, Nakash Aziz",Dance
Galla Goriyan – Aaja Soniye,"Kanika Kapoor, Mika Singh",Dance
Mubarakan Title Song,"Badshah, Juggy D, Sukriti Kakar, Yash Narvekar",Dance
Nachdi Phira,Meghna Mishra,Sad
Maula Mere Maula,Roop Kumar Rathod,Romantic
Raah Mein Unse Mulaqat,"Alka Yagnik, Kumar Sanu",Romantic
Resham Ka Rumaal,"Sonia Sharma, Toshi Sabri",Dance
Twist Kamariya,"Altamash Faridi, Harshdeep Kaur, Tanishk Baagchi, Yasser Desai",Dance
Ram Chahe Leela,Bhoomi Trivedi,Dance
Ram Chahe Leela,Bhoomi Trivedi,Dance
Kukkad Kamaal Da,"Marianne, Nisha Mascarenhas, Shahid Mallya",Dance
Aa Jao Na,"Arijit Singh, Shashwat Sachdev",Sad
Banjaara,"Mohammed Irfan, Shashaa Tirupati",Romantic
Radha Kaise Na Jale,"Asha Bhosle, Udit Narayan",DanceRomantic
Bewajah,Himesh Reshammiya,Sad
London Thumakda,"Labh Janjua, Neha Kakkar, Sonu Kakkar",Dance
Aashiq Banaya Aapne,"Himesh Reshammiya, Shreya Ghoshal",Sensual
Kheench Meri Photo,"Akasa Singh, Darshan Raval, Neeti Mohan",Dance
Aayega Maza Ab Barsaat Ka,"Alka Yagnik, Babul Supriyo",Romantic
Bewafa Beauty,Pawni Pandey,
Birthday Bash,"Alfaaz, Yo Yo Honey Singh",Dance
Jumme Ki Raat,"Mika Singh, Palak Muchhal",Dance
Jab Koi Baat Bigad Jaye,"Kumar Sanu, Sadhna Sargam",Romantic
Tera Hone Laga Hoon,"Alisha Chinai, Atif Aslam",Romantic
Sheila Ki Jawani,"Sunidhi Chauhan, Vishal Dadlani",Dance
Uff,"Benny Dayal, Harshdeep Kaur",Dance
Sunny Sunny,Yo Yo Honey Singh,Dance
Ghagra,"Rehka Bharadwaj, Vishal Dadlani",Dance
Paani Wala Dance,"Arko, Ikka, Shraddha Pandit",Dance
Dola Re Dola,"K.K., Kavita Krishnamurthy, Shreya Ghoshal",Dance
Jab Tum Chaho,"Darshan Raval, Mohammed Irfan, Palak Muchhal",Dance
Tere Bina Zindagi Se Koi Shikwa To Nahin,"Kishore Kumar, Lata Mangeshkar",Sad
Mujhe Ek Pal Chain,"Alka Yagnik, Hariharan, Jaswinder Narula",Dance
Kuch Iss Tarah,Arnab Dutta,Sad
Gazab Ka Hai Din,"Jubin Nautiyal, Prakriti Kakkar",Romantic
Tu Jaane Na,Atif Aslam,Romantic
Tumne Agar Pyar Se – Female,Alka Yagnik,Dance
Stay A Little Longer,Anushka Shahaney,Sad
Badtameez Dil,Benny Dayal,Dance
Chand Sifarish,"Kailash Kher, Shaan",Romantic
Is Pyar Se Meri Taraf Na Dekho,"Alka Yagnik, Kumar Sanu",Romantic
Aaj Unse Milna Hai,Shaan,DanceRomantic
Tere Bin Nahi Laage,Uzair Jaswal,RomanticSad
Yaar Na Miley,"Jasmine Sandlas, Yo Yo Honey Singh",Dance
Main Rang Sharbaton Ka,Atif Aslam,Romantic
Raazi Title Track,Arijit Singh,Motivational
Hum Tumhe Chahte Hai Aise,"Anand Kumar C, Kanchan, Manhar Udhas",Romantic
Ittefaq Se Raat Baaki,"Jubin Nautiyal, Nikhita Gandhi",Dance
Oye Oye,"Aditi Singh Sharma, Armaan Malik",Dance
Sooraj Dooba Hai,"Adit Singh Sharma, Arijit Singh",Dance
Will You Marry me,"Divya Kumar, Jonita Gandhi",Dance
Tera Hoke Rahoon,Arijit Singh,Romantic
Aa Re Pritam Pyaare,"Mamta Sharma, Sarosh Sami",Dance
Mehboob Mere Mehboob Mere,"Lata Mangeshkar, Mukesh",Romantic
Dil Mein Chhupa Loonga,"Armaan Malik, Meet Bros, Tulsi Kumar",RomanticSensual
Dance Basanti,"Anushka Manchanda, Vishal Dadlani",Dance
Teri Meri Prem Kahani,"Rahat Fateh Ali Khan, Shreya Ghoshal",Sad
Lungi Dance,Yo Yo Honey Singh,Dance
Jeena Jeena,Atif Aslam,RomanticSad
Thare Vaaste,Divya Kumar,Patriotic
Maine Socha Ke Chura Loon,"Arijit Singh, Shreya Ghoshal",Romantic
Mar Gaye,"Manj Musik, Nindy Kaur",Dance
Cutiepie,"Nakash Aziz, Pardeep Singh Sran",Dance
Lipstick Laga Ke,"Payal Dev, Shaan",Dance
Laila,"Anand Raaj Anand, Mika Singh, Sunidhi Chauhan",Dance
Tu Mera Hero,"Mika, Shefali Alvaris",Dance
A Flying Jatt,"Mansheel Gujral, Raftaar, Tanishkaa",Dance
World Dance Medley,"K.K., Neeti Mohan, Shankar Mahadevan, Sukhwinder Singh, Vishal Dadlani",DanceRomantic
Qayamat,"Alka Yagnik, Sukhwinder Singh",Dance
Matargashti,Mohit Chauhan,Dance
Pehla Nasha Once Again,"Jubin Nautiyal, Palak Muchhal",Romantic
Raj Karega Khalsa,"Daler Mehndi, Navraj Hans",Motivational
Punjabi Wedding Song,"Benny Dayal, Sunidhi Chauhan",Dance
Rabba Ishq Na Hove,"Alka Yagnik, Kailash Kher, Sapna Mukherjee, Sonu Nigam",Sad
Tumhi Ho Bandhu,"Kavita Seth, Neeraj Shridhar",Dance
Saans,"Mohit Chauhan, Shreya Ghoshal",Romantic
Besharmi Ki Height,"Benny Dayal, Shalmali Kholgade",Dance
Mere Rashke Qamar,Tulsi Kumar,DanceSad
Besabriyaan,Armaan Malik,
Tu Hai Ki Nahin,Ankit Tiwari,Sad
Aaj Ki Party,Mika Singh,Dance
Saaton Janam Main Tere,"Alka Yagnik, Kumar Sanu",Romantic
Allah Kare Dil Na Lage,"Alka Yagnik, Sonu Nigam",Romantic
Ye Jo Teri Paylon Ki,"Abhijeet, Sadhana Sargam",Dance
Tum,Atif Aslam,Romantic
Radha Nachegi,"Danish Sabri, Ritu Pathak, Shabab Sabri",Dance
Itni Si Baat Hai,"Antara Mitra, Arijit Singh",Romantic
Laagi Na Choote,"Arijit Singh, Shreya Ghoshal",Romantic
Sab Tera,"Armaan Malik, Shraddha Kapoor",Romantic
Mashallah,"Shreya Ghoshal, Wajid",Dance
Taaron Ka Chamakta,"Bali Brahambhatt, Udit Narayan",Dance
Sau Tarah Ke,"Amit Mishra, Jonita Gandhi",Dance
Gulabi Aankhen,Mohammed Rafi,DanceRomantic
Gulaabo,"Anusha Mani, Vishal Dadlani",Dance
Ya Ali,Zubeen Garg,Sad
Lahu Munh Lag Gaya,Shail Hada,Dance
Yeh Kasoor Mera Hai,Sonu Kakkar,RomanticSadSensual
Shanivaar Raati,"Arijit Singh, Shalmali Kholgade",Dance
Tere Dil Mein,Armaan Malik,Sad
Jab Haal E Dil Tumse Kehne Ko,Alka Yagnik,Dance
Tattad Tattad,Aditya Narayan,Dance
Mohe Rang Do Laal,"Pandit Birju Maharaj, Shreya Ghoshal",Romantic
Ek Haseena Thi,"Himesh Reshammiya, Shreya Ghoshal",Dance
Kahin Pyaar Na Ho Jaye,"Alka Yagnik, Kumar Sanu",Romantic
Ek Do Teen,Alka Yagnik,Dance
Maahi Ve,"Sadhana Sargam, Shankar Mahadevan, Sonu Nigam, Udit Narayan",Dance
Tere Mere,Armaan Malik,Sad
Allah Maaf Kare,"Shilpa Rao, Sonu Nigam",DanceRomantic
Le Le Maza Le,"Hrishikesh Kamerkar, Nikita Nigam, Soumya Raoh, Suzanne D'Mello",Dance
Jaa Sajna Tujhko Bhula,"Alka Yagnik, Udit Narayan",Sad
Nazar Se Nazar Mile,Rahat Fateh Ali Khan,Romantic
Gandi Baat,"Kalpana Patowary, Mika Singh",Dance
Sarphiri,"Babul Supriyo, Shreya Ghoshal",Romantic
Mere Sapno Ki Rani,Kishore Kumar,DanceRomantic
Dum Dum,"Benny Dayal, Himani Kapoor",Dance
Sari Duniya Ka Boj,Shabbir Kumar,Dance
Pink Lips,"Anjjan, Khushhboo Grewal, Meet Bros",Dance
Pee Loon,Mohit Chauhan,Romance
Khali Khali Dil,"Armaan Malik, Payal Dev",Romantic
Hare Krishna Hare Ram,"Armaan Malik, Ritika",Dance
Single Rehne De,"Divya Kumar, Shalmali Kholgade",Dance
Jhak Maar Ke,"Harshdeep Kaur, Neeraj Shridhar",Dance
Naa Jaane,"Anushka Manchanda, Neeraj Shridhar",Dance
Party On My Mind,"K.K., Shefali Alvares, Yo Yo Honey Singh",Dance
Kajra Re,"Alisha Chinai, Javed Ali, Shankar Mahadevan",Dance
Likhe Jo Khat Tujhe,Mohammed Rafi,Dance
Jhanjariya,Abhijeet,Dance
O Saathi Re Tere Bina,"Anjaan, Kishore Kumar",Sad
Tare Hain Barati,"Jaspinder Narula, Kumar Sanu",Dance
Tu Zaroorat Nahi Tu Zaroori Hai,"Gandharv Sachdev, Shreya Ghoshal",Sad
Iski Uski,"Akriti Kakar, Shahid Mallya",Dance
Chote Chote Bhaiyon Ke Bade Bhaiya,"Kavita Krishnamurthy, Kumar Sanu, Udit Narayan",Dance
Saiyaan Superstar,Tulsi Kumar,Dance
Every Night & Day,"Himesh Reshammiya, Iulia Vantur",Dance
