Song-Name,Singer/Artists,Genre
Photocopy,"Himesh Reshammiya, Keerthi Sagathia, Palak Muchhal",Dance
Dil Tu Hi Bataa,"Alisha Chinai, Zubeen Garg",Romantic
Beech Beech Mein,"Arijit Singh, Shalmali Kholgade, Shefali Alvares",Dance
Aakhon Aakhon,Yo Yo Honey Singh,Dance
Kabhi Alvida Naa Kehna Title Track,"Alka Yagnik, Sonu Nigam",RomanticSad
All Izz Well,"Shaan, Sonu Nigam, Swanand Kirkire",Dance
Chandralekha,"Jonita Gandhi, Vishal Dadlani",Dance
Mitwa,"Caralisa Monteiro, Shafqat Amanat Ali, Shankar Ehsaan Loy, Shankar Mahadevan",Dance
Baat Ban Jaaye,"Priya Saraiya, Siddharth Basrur",DanceRomantic
Oye Hichki,Harshdeep Kaur,Dance
Ang Laga De,"Aditi Paul, Shail Hada",RomanticSensual
Lagdi Hai Thaai,"Guru Randhawa, Jonita Gandhi",Dance
Ishq Chadha Hai,Darshan Raval,Romantic
Bandeya,Arijit Singh,Sad
Love Mera Hit Hit,"Neeraj Shridhar, Tulsi Kumar",Dance
Ishq Da Sutta,"Jasmine Sandlas, Meet Bros",Dance
Zindagi Kuch Toh Bata,Jubin Nautiyal,
Haareya,Arijit Singh,Romantic
Patthar Ke Sanam,Mohammed Rafi,Sad
The Medley,"Lata Mangeshkar, Pamela Chopra, Sonu Nigam, Udit Narayan",Dance
Raghupati Raghav,"Bob, Monali Thakur, Neeraj Shridhar",Dance
The Padman Song,Mika Singh,Dance
Go Pagal,"Nindy Kaur, Raftaar",Dance
Sadi Gali,Lehmber Hussainpuri,Dance
Daiya Daiya Daiya Re,Alka Yagnik,DanceRomantic
Challa,Rabbi Shergill,Dance
Thoda Aur,"Arijit Singh, Palak Muchhal",Romantic
Sexy Baby Girl,"Lil Golu, Swati Sharma",Dance
Ek Dilruba Hai,Udit Narayan,DanceRomantic
Tu Pyar Hai Kisi Aur Ka,"Anuradha Paudwal, Kumar Sanu",Sad
Aata Majhi Satakli,"Mamta Sharma, Nitu Choudhry, Yo Yo Honey Singh",Dance
Ishq Bulaava,Sanam Puri,Romantic
Thug Le,"Sweta Pandit, Vishal Dadlani",Dance
Hum Mar Jayenge,"Arijit Singh, Tulsi Kumar",Sad
Desi Girl,"Shankar Mahadevan, Sunidhi Chauhan, Vishal Dadlani",Dance
Madamji Go Easy,"Benny Dayal, David Klyton",Dance
Tu Dharti Pe Chaahe Jahan Bhi,"Alka Yagnik, Kumar Sanu",Romantic
Sandese Aate Hain,"Roop Kumar Rathod, Sonu Nigam",Patriotic
Tenu Le Ke,"Mahalakshmi Iyer, Sonu Nigam",Dance
Pehli Nazar Mein,Atif Aslam,Romantic
I Wanna Tera Ishq,"Shivangi Bhayana, Shivranjani Singh",Dance
Nimbooda Nimbooda,"Ismail Darbar, Kavita Krishnamurthy",Dance
Tera Rang Balle Balle,"Jaspinder Narula, Sonu Nigam",Dance
Dil Laga Na,"Jolly Mukherjee, Mahalaxmi Iyer, Soham Chakrabarthy, Sukhbir, Suzanne D'Mello",Dance
Naina Banjare,Arijit Singh,Romantic
Yadaan Teriyaan,Rahat Fateh Ali Khan,
Asalaam-E-Ishqum,"Bappi Lahiri, Neha Bhasin",Dance
Nadaan Parindey,A.R. Rahman,Sad
You Are My Soniya,"Alka Yagnik, Sonu Nigam",Dance
Aaja Nachle,Sunidhi Chauhan,Dance
Piya O Re Piya,"Atif Aslam, Shreya Ghoshal",Romantic
Halka Halka,"Ram Sampath, Shreya Ghoshal, Sonu Nigam",DanceRomantic
Peh Gaya Khalara,"Akanksha Bhandari, Akasa Singh, Divya Kumar, Jasleen Royal",Dance
Malang,"Shilpa Rao, Siddharth Mahadevan",Dance
Kuch Kuch Hota Hai,"Alka Yagnik, Udit Narayan",Romantic
Tay Hai,Ankit Tiwari,Sad
Usire Usire,"Shaan, Shreya Ghoshal",DanceRomantic
Papa Mere Papa,"Baby Aparna, Shreya Ghoshal, Sonu Nigam",
Go Go Govinda (Reprise),"Aaman Trikha, Shreya Ghoshal",Dance
Go Go Govinda,"Aman Trikha, Shreya Ghoshal",Dance
Tu Mujhe Kabool,"Kavita Krishnamurthy, Mohammad Aziz",Dance
Hori Khele Raghuveera,"Alka Yagnik, Amitabh Bachchan, Sukhwinder Singh, Udit Narayan",Dance
Aap Ka Aana Dil Dhadkana,"Alka Yagnik, Kumar Sanu",Dance
Love Tujhe Love Main Karta,"Alka Yagnik, Kumar Sanu",Romantic
Just Go to Hell Dil,"Amit Trivedi, Sunidhi Chauhan",Sad
Party All Night,Yo Yo Honey Singh,Dance
Talli Tonight,"Deep Money, Meet Bros, Mellow D, Neha Kakkar",Dance
Darasal,Atif Aslam,Romantic
Mauja Hi Mauja,Mika Singh,Dance
Dhokha Dhadi,Arijit Singh,Romantic
Dhoom Machale Dhoom,Aditi Singh Sharma,Dance
Ikk Kudi,Diljit Dosanjh,Romantic
Jhalak Dikhla Ja,Himesh Reshammiya,Dance
Baby Doll,"Anjjan, Kanika Kapoor, Meet Bros",Dance
Laila O Laila,"Amit Kumar, Kanchan",Dance
Jaane De,Atif Aslam,
Dilli Wali Girlfriend,"Arijit Singh, Sunidhi Chauhan",Dance
Mar Jaayen,Atif Aslam,Sad
I Love My India,"Hariharan, Kavita Krishnamurthy",Dance
O Sahiba O Sahiba,"Kavita Krishnamurthy, Sonu Nigam",Sad
O Saaki Saaki,"Sukhwinder Singh, Sunidhi Chauhan",Dance
Let’s Talk About Love,"Manj Musik, Neha Kakkar, Raftaar",Dance
Satakli,Sukhwinder Singh,Dance
Kashmir Main Tu Kanyakumari,"Arijit Singh, Neeti Mohan, Sunidhi Chauhan",Dance
Kaala Doreya,Neha Bhasin,
Raabta,"Arijit Singh, Hamsika, Joi",Romantic
Vele,"Shekhar Ravjiani, Vishal Dadlani",Dance
440 Volt,Mika Singh,Dance
Aapka Kya Hoga,"Arun Ingle, Mika Singh, Sajid Khan, Shankar Mahadevan, Sunidhi Chauhan",Dance
Tere Ishq Mein Naachenge,"Alisha Chinai, Kumar Sanu, Sapna Mukharji",Dance
Kisi Ki Muskurahaton Se,Mukesh,Dance
Bawara Mann,"Jubin Nautiyal, Neeti Mohan",Romantic
Tere Bina (Guru),"A.R. Rahman, Chinmaye, Murtuza Khan, Qadir Khan",Dance
Itna Sannata Kyun Hai,"Aditi Singh Sharma, Amit Mishra",Dance
Desi Look,Kanika Kapoor,Dance
Chamakti Shaam Hai,"Alka Yagnik, Sonu Nigam",Dance
Sarsariya,"Shashaa Tirupati, Shashwat Singh",Romantic
Jag Soona Soona Lage,,Sad
Kandhon Se Milte Hain Kandhe,"Hariharan, Kunal Ganjawala, Roop Kumar Rathod, Shankar Mahadevan, Sonu Nigam, Vijay Prakash",Patriotic
Deewangi Deewangi,"Rahul Saxena, Shaan, Shreya Ghoshal, Sunidhi Chauhan, Udit Narayan",Dance
Tareefan Remix,Badshah,Dance
Samjhawan,"Arijit Singh, Shreya Ghoshal",Sad
Bam Lahiri,Kailash Kher,Dance
Chicken Kuk Doo Koo,"Mohit Chauhan, Palak Muchhal",Dance
Dhating Naach,"Nakash Aziz, Neha Kakkar",Dance
Tu Itni Khoobsurat Hai,Rahat Fateh Ali Khan,Sad
O Priya Priya,"Anuradha Paudwal, Shabbir Kumar",Sad
Manchala,"Nupur Pant, Shafqat Amanat Ali",Sad
Lukka Chuppi,"A.R. Rahman, Lata Mangeshkar",Sad
Prem Leela,"Aaman Trikha, Vineet Singh",Dance
Khuda Jaane,"K.K., Shilpa Rao",Romantic
Premika,"Benny Dayal, Kanika Kapoor",Dance
Tera Mujhse Hai Pehle Ka Naata Koi,"Kishore Kumar, Sushma Shrestha",Romantic
Character Dheela,"Amrita Kak, Neeraj Shridhar",Dance
Munni Badnam Hui,"Aishwarya, Mamta Sharma",Dance
Saadda Haq,Mohit Chauhan,Dance
Rehnuma,"Inder Bawra, Shreya Ghoshal",RomanticSad
Ilahi,Arijit Singh,Dance
Neendein Khul Jaati Hain,"Kanika Kapoor, Meet Bros, Mika Singh",Dance
Phir Le Aya Dil,Shafqat Amanat Ali,Sad
Main Yahaan Hoon,Udit Narayan,Dance
Soni Soni,"Ishaan, Jaspinder Narula, Manohar Shetty, Pritha Majumdar, Shweta Pandit, Sonali Bhatawdekar, Udbhav, Udit Narayan",Dance
Rocket Saiyyan,"Brijesh Shandilya, Ritu Pathak, Tanishk Baagchi",Dance
Khol De Par,Arijit Singh,
Humko Humise Chura Lo,"Lata Mangeshkar, Udit Narayan",Romantic
Be Intehaan,"Atif Aslam, Sunidhi Chauhan",Romantic
Subhanallah,"Shilpa Rao, Sreerama Chandra Mynampati",Romantic
Dholna,"Lata Mangeshkar, Udit Narayan",Romantic
Koi Ishaara,Armaan Malik,RomanticSad
Phir Bhi Dil Hai Hindustani,Udit Narayan,DancePatriotic
Kore Kore Sapne,"Anuradha Paudwal, Kumar Sanu",Dance
Hale Dil,Harshit Saxena,Romantic
Aaoge Jab Tum,Rashid Khan,Sad
Tinku Jiya,"Javed Ali, Mamta Sharma",Dance
Lakshya – Title Track,Shankar Mahadevan,MotivationalPatriotic
Pretty Woman,"Ravi Khote, Shankar Mahadevan",Dance
Silsila Ye Chaahat Ka,Shreya Ghoshal,Romantic
Helicopter,"Neha Kakkar, Tony Kakkar",Dance
Kabhi Khushi Kabhie Gham,Lata Mangeshkar,Sad
Chak Lein De,Kailash Kher,Motivational
Meri Aashiqui Ab Tum Hi Ho,"Arijit Singh, Palak Muchhal",RomanticSad
Tere Dware Pe Aai Baraat,"Ravindra Jain, Sudesh Bhosle",Dance
Badi Mushkil Hai,Abhijeet,Romance
Toh Dishoom,"Raftaar, Shahid Mallya",Dance
Kudiye Ni Tere,"Shivangi Bhayana, Udit Narayan",Romantic
Hu Ba Hu,Amit Trivedi,Dance
Kitna Pagal Dil Hai,Kumar Sanu,Romantic
Sahiba Russ Gayiya,Rahat Fateh Ali Khan,Sad
Mehfooz,Yasser Desai,RomanticSad
Veerey Ki Wedding,Navraj Hans,Dance
Ek Pal Ka Jeena,Lucky Ali,Dance
Gori Tu Latth Maar,"Palak Muchhal, Sonu Nigam",Romantic
Jal Rahin Hain,Kailash Kher,
Tum Jo Mile,Armaan Malik,Romantic
Saathiya Tune Kya Kiya,"K. S. Chithra, S.P. Balasubrahmanyam",Dance
Humne Pee Rakhi Hai,"Ikka, Jaz Dhami, Neha Kakkar",Dance
Bheegi Si Bhaagi Si,Mohit Chauhan,Romance
Chura Liya Hai,Mohammed Rafi,Romantic
Right Now Now,"Sunidhi Chauhan, Suzanne D'Mello, Wajid",Dance
Crazy Kiya Re,Sunidhi Chauhan,Dance
Ziddi Dil,Vishal Dadlani,Motivational
Abhi Abhi,K.K.,RomanticSad
Bahara,"Shreya Ghoshal, Sona Mohapatra",Romantic
Dekh Lena,"Arijit Singh, Tulsi Kumar",Romantic
Dheere Dheere Se Meri Zindagi Mein Aana,"Anuradha Paudwal, Kumar Sanu",
Tu Zaroori,"Sharib Sabri, Sunidhi Chauhan",Romantic
Afeemi,"Jigar Saraiya, Sanah Moidutty",Romantic
Salaam E Ishq,"Kunal Ganjawala, Sadhana Sargam, Shankar, Shreya Ghosal, Sonu Nigam",Dance
Naughty Billo,"Diljit Dosanjh, Nakash Aziz, Shilpi Paul",Dance
Behka,Vibha Saraf,Dance
Pyar Ke Liye,Alka Yagnik,Romantic
Dil Na Diya,Kunal Ganjawala,Dance
Sukoon Mila,Arijit Singh,Romantic
Dil To Pagal Hai,"Lata Mangeshkar, Udit Narayan",Romantic
Do Anjaane Ajnabi,"Shreya Ghoshal, Udit Narayan",Romantic
Tujh Mein Rab Dikhta Hai,Roop Kumar Rathod,Romantic
Palki Mein Hoke Sawar Chali Re,Alka Yagnik,Dance
Andekhi Anjaani,"Lata Mangeshkar, Udit Narayan",Romantic
Dhinka Chika,"Amrita Kak, Mika Singh",Dance
Main Agar,Atif Aslam,Romantic
Kyon,"Papon, Sunidhi Chauhan",Romantic
Tera Mera Milna,"Himesh Reshammiya, Shreya Ghoshal",Sad
Daayre,Arijit Singh,Romantic
Sahiba,"Pawni Pandey, Romy",Sad
Saajan Saajan,"Alka Yagnik, Kumar Sanu, Udit Narayan",DanceRomantic
Aisa Des Hai Mera,"Gurdas Maan, Lata Mangeshkar, Preetha Mazumdar, Udit Narayan",Patriotic
Lost Without You,"Ami Mishra, Anushka Shahaney",Sad
Dhal Jaun Main,"Aakanksha Sharma, Jubin Nautiyal",RomanticSad
Badass Babuaa,"Abhishek Nailwal, Neha Bhasin, Sameer Uddin",Dance
Aaj Kehna Zaroori Hai,"Alka Yagnik, Udit Narayan",Romantic
Ye Toh Sach Hai Ke Bhagwan,Hariharan,Dance
Dastaan-e-Om Shanti Om,Shaan,Dance
Saanson Ke,K.K.,Sad
O Jiji,"Pamela Jain, Shreya Ghoshal",Dance
Hug Me,"Kanika Kapoor, Raghav Sachar",Dance
Halkat Jawani,Sunidhi Chauhan,Dance
Ek Dil Hai,"Alka Yagnik, Kumar Sanu",Romantic
Black Jama Hai,Sukhwinder Singh,
Confused Lover,"Aaniya, Mika Singh",Dance
Tumse Milne Ki Tamanna Hai,S.P. Balasubrahmanyam,Dance
Afsana,"Himesh Reshammiya, Tulsi Kumar",Dance
Naina,"Armaan Malik, Sona Mohapatra",RomanticSad
Naina,"Armaan Malik, Sona Mohapatra",Sad
Dil Mein Dard Sa Jaga Hai,"Alka Yagnik, Udit Narayan",Dance
Anarkali Disco Chali,"Mamta Sharma, Sukhwinder Singh",Dance
Jab Dil Miley,"Asha Bhosle, Udit Narayan",Dance
Humko Humise Chura Lo,"Lata Mangeshkar, Udit Narayan",Romantic
Make Some Noise For The Desi Boyz,"Bob, K.K.",Dance
Aga Bhai,Monali Thakur,Dance
Sehmi Hai Dhadkan,Atif Aslam,Sad
Jawaani Le Doobi,"Kanika Kapoor, Uvie",Dance
Humko Tumse Pyar Hai,Abhijeet,Dance
Sadda Move,"Diljit Dosanjh, Pardeep Singh Sran",Dance
Soniyo,"Neeraj Shridhar, Raju Singh, Shreya Ghoshal, Sonu Nigam",Romantic
Kaun Nachdi,"Guru Randhawa, Neeti Mohan",Dance
Dhoom Machale,Sunidhi Chauhan,DanceRomantic
Door Na Ja,Sonu Nigam,Sad
Ishq Shava,"Raghav Mathur, Shilpa Rao",Dance
Boss Title Track,"Anjjan, Meet Bros, Yo Yo Honey Singh",Dance
Tum Ko Dekha To Yeh Khayal Aya,"Chitra Singh, Jagjit Singh",Romantic
Jaane Nahi Denge Tujhe,Sonu Nigam,Sad
Tadap Tadap,"Dominique, K.K.",Sad
Senti Wali Mental,"Amit Trivedi, Arijit Singh, Neeti Mohan, Swanand Kirkire",Dance
Sapna Jahan,"Neeti Mohan, Sonu Nigam",Sad
Urvashi Urvashi,"A.R. Rahman, Noel James, Shankar Mahadevan",Dance
Tere Bina,"Arijit Singh, Priya Saraiya",Romantic
Hoor,Atif Aslam,Sad
Chhoti Chhoti Raatein,"Anuradha Paudwal, Sonu Nigam",DanceRomantic
Sanson Ki Zarurat Hai Jaise,Kumar Sanu,Romantic
Zoobi Doobi,"Shreya Ghoshal, Sonu Nigam",DanceRomantic
Mannat,"Keerthi Sagathia, Shreya Ghoshal, Sonu Nigam",Dance
Intezaar,Shreya Ghoshal,Sad
Agar Tu Hota,Ankit Tiwari,Sad
Hai Dil,"Alka Yagnik, Kumar Sanu",Romantic
Pardesiya,"Ehsaan Noorani, Hemant Brijwasi, Sahil Akhtar, Shankar Mahadevan, Shehnaz Akhtar",Sad
Ishtehaar,"Dhvani Bhanushali, Rahat Fateh Ali Khan",Sad
Twist,Neeraj Shridhar,Dance
You’re My Life,"Earl, Shaan, Shweta Pandit, Suzanne D'Mello",DanceRomantic
Mat Maari,"Kunal Ganjawala, Sunidhi Chauhan",Dance
Mujhse Juda Hokar,"Lata Mangeshkar, S.P. Balasubrahmanyam",Sad
Second Hand Jawaani,"Miss Pooja, Nakkash Aziz, Neha Kakkar",Dance
Naina Re,"Himesh Reshammiya, Rahat Fateh Ali Khan, Shreya Ghoshal",Sad
Tere Naina,"Shafqat Amanat Ali, Shankar Ehsaan Loy",Romantic
Haathon Mein Thhe Haath,"Aditi Singh Sharma, Altamash Faridi, Arpita Mukherjee, Papon",Sad
Gajanana,"Shreyas Puranik, Sukhwinder Singh",Devotional
Tum Mile,Neeraj Shridhar,Romantic
Meri Khamoshi Hai,Ishan Mitra,Sad
Oh My Darling,"Alisha Chinai, Sonu Nigam",Dance
Nainon Men Sapna,"Kishore Kumar, Lata Mangeshkar",Dance
Tu Jo Hain,Ankit Tiwari,RomanticSad
Dheere Dheere Bol Koi Sun Na Le,"Lata Mangeshkar, Mukesh",Romantic
Mohenjo Daro,"A.R. Rahman, Arijit Singh, Bela Shende, Sanah Moidutty",Dance
Jai Jai Shiv Shankar,"Kishore Kumar, Lata Mangeshkar",Dance
Ladki Kyon Na Jane Kyon,"Alka Yagnik, Shaan",Dance
Drama Queen,"Shreya Ghoshal, Vishal Dadlani",Dance
Khaike Paan Banaras Wala,Kishore Kumar,Dance
Tu Hi Haqeeqat,"Irshan Ashraf, Javed Ali, Shadaab Faridi",Romantic
Tune Maari Entriyaan (Bangla Version),"Bappi Lahiri, Monali Thakur",Dance
Gudgudi,Sunidhi Chauhan,
Yeh Kaisi Jagah,"Deepali Sathe, Zubeen Garg",Sad
Bass Gira De Raja,Shashwat Sachdev,
Wada Karle Sajna Tere Bina,"Lata Mangeshkar, Mohammed Rafi",Romantic
Jhalla Wallah,Shreya Ghoshal,Dance
Hamesha Tumko Chaha,"Kavita Krishnamurthy, Udit Narayan",Sad
Mujhko Barsaat Bana Lo,Armaan Malik,Romantic
Aaya Tere Dar Par,"Ahmed Hussain, Javed Hussain, Mohd Vakil, Mohd. Hussain",Devotional
Ho Nahi Sakta,Udit Narayan,Romantic
Saale Sapne,Mohit Chauhan,
Kaun Tujhe,Armaan Malik,Romantic
Tere Liye,"Atif Aslam, Shreya Ghoshal",Dance
Tu Isaq Mera,"Meet Bros, Neha Kakkar",RomanticSensual
Shaam Shaandaar,Amit Trivedi,Dance
Banjaara,Sukhwinder Singh,DanceRomantic
Akkha India Janta Hai,Kumar Sanu,Romantic
Tharki Chokro,Swaroop Khan,Dance
Phir Se,"Nikhil Dsouza, Shreya Ghoshal",
Gale Lag Ja,"Banjyotsna, Javed Ali",DanceSensual
Aadat (Juda Hoke Bhi),Atif Aslam,Sad
Jane Kaise Kab Kahan Iqrar Ho Gaya,"Kishore Kumar, Lata Mangeshkar",Romantic
Agar Tum Mil Jao,Shreya Ghoshal,Romantic
Kaara Fankaara,"A.R. Rahman, Aaryan Dinesh Kanagaratnam, Ashima Mahajan, Hard Kaur, Kaly, Paroma Dasgupta, Shashaa Tirupati",Dance
Chokra Jawaan,"Sunidhi Chauhan, Vishal Dadlani",Dance
Didi Tera Devar Deewana,"Lata Mangeshkar, S.P. Balasubrahmanyam",Dance
Saiyan Re,"Mohammed Irfan, Palak Muchhal",Romantic
Pal Pal Dil Ke Paas,Kishore Kumar,Romantic
Rail Gaddi,"Navraj Hans, Swati Sharrma",Dance
Ek Din Bik Jayega Mati Ke Mol,Mukesh,Dance
Main Koi Aisa Geet,Abhijeet,Dance
Yeh Ishq Hai,Shreya Ghoshal,Dance
Alizeh,"Alizeh Ash King, Arijit Singh, Shashwat Singh",Romantic
Kaho Na Kaho,Amir Jamal,RomanticSensual
Imli Ka Boota,"Mohammad Aziz, Sudesh Bhonsle",
Hey Shona,"Shaan, Sunidhi Chauhan",DanceRomantic
Chalte Chalte,"Manohar Shetty, Preetha Mazumdar, Sonali Bhatawdekar, Udbhav",Dance
Iktara,"Amit Trivedi, Amitabh Bhattacharya, Kavita Seth",Romantic
Aap Ki Nazron Ne Samjha,Lata Mangeshkar,Romantic
Tu Chahiye,Atif Aslam,Romantic
Ole Ole,Abhijeet,Dance
Tutak Tutak Tutiya,"Kanika Kapoor, Malkit Singh, Sonu Sood",Dance
Meri Duniya Tu Hi Re,"Shaan, Shankar Mahadevan, Sonu Nigam",Dance
Mujhko Yaad Sataye Teri,Himesh Reshammiya,Dance
Jane Kahan Gaye Woh Din,Mukesh,Sad
Nonsense Ki Night,Mika Singh,Dance
Daaru Desi,"Benny Dayal, Shalmali Kholgade",Dance
Fugly Fugly Kya Hai,Yo Yo Honey Singh,Dance
Buddhu Sa Mann,"Amaal Mallik, Armaan Malik",Dance
Jiska Mujhe Tha Intezar,"Kishore Kumar, Lata Mangeshkar",Romantic
Raat Ka Nasha,K. S. Chithra,Dance
Zara Zara Touch Me,Monali Thakur,DanceSensual
Wada Karo Nahi Chodoge,"Kishore Kumar, Lata Mangeshkar",Romantic
Sajde,"Arijit Singh, Gulzar, Nihira Joshi Deshpande",Romantic
Khair Mangda,Atif Aslam,Sad
Tere Naal Ishqa,Kailash Kher,Sad
Na Na Na Re,"Daler Mehndi, Sudesh Bhonsle",Dance
Tum Aa Gaye Ho Noor Aa Gaya Hai,"Kishore Kumar, Lata Mangeshkar",Romantic
Mujeh Naulakha Mangade,"Bappi Lahiri, Kishore Kumar",Dance
Ainvayi Ainvayi,"Salim Merchant, Sunidhi Chauhan",Dance
Awaaz Deke,"Lata Mangeshkar, Mohammed Rafi",Romantic
Tum Tak,"A.R. Rahman, A.V. Pooja, Javed Ali, Kirti Sagathia",DanceRomantic
Chitta Ve,"Babu Haabi, Bhanu Pratap, Shahid Mallya",Dance
Get Up Jawani,"Badshah, Yo Yo Honey Singh",Dance
Ji Huzoori,"Deepali, Mithoon",Romantic
Dhingana,Mikha Singh,Dance
Sapna,Arijit Singh,Sad
Bandeyaa,Jubin Nautiyal,Sad
Maula Mere Lele Meri Jaan,"Krishna Beura, Salim Merchant",DevotionalSad
Rang De Basanti,"Daler Mehndi, K. S. Chithra",DancePatriotic
Kundali,"Anita Gandharva, Meenal Jain, Meghna Mishra, Rani Kaur, Vaishnavi Mishra, Yashika Sikka, Yashita Sharma",Dance
Shuru Kar,"Amit Mishra, Neha Bhasin, Rochak Kohli",Dance
Je T’aime,"Sunidhi Chauhan, Vishal Dadlani",
Tooh,"Mamta Sharma, Mika Singh, Shekhar, Vishal",Dance
Main Tera Dhadkan Teri,"Hard Kaur, K.K., Sunidhi Chauhan",Dance
Le Gayi,Asha Bhosle,Dance
Le Gayi,Asha Bhosle,Dance
Aankhein Khuli,"Ishaan, Lata Mangeshkar, Manohar Shetty, Shweta Pandit, Sonali Bhatawdekar, Udbhav, Udit Narayan",Dance
Rang Barse,Amitabh Bachchan,Dance
Gawah Hai Chand Tare,"Alka Yagnik, Kumar Sanu",Romantic
Aisa Kyun Maa,Sunidhi Chauhan,Sad
Tu Hi Re,Hariharan,Romantic
Mera Mann Kehne Laga,Falak Shabir,Dance
Shut Up & Bounce,"Sunidhi Chauhan, Vishal Dadlani",Romantic
One Two Three Four,"Hamsika Iyer, Vishal Dadlani",Dance
Haseeno Ko Aate Hain,"Alka Yagnik, Udit Narayan",Dance
Kasam Khake Kaho,"Alka Yagnik, Kumar Sanu",Romantic
Dil Ka Rishta,"Alka Yagnik, Kumar Sanu, Udit Narayan",Romantic
Sajdaa,"Rahat Fateh Ali Khan, Richa Sharma, Shankar Mahadevan",Romantic
Mujhe Tumse Mohabbat Hai,"Shaan, Shreya Ghoshal",DanceRomantic
Tujhe Dekha To,"Kumar Sanu, Lata Mangeshkar",Romantic
Watan Wallon Watan Na,"Alka Yagnik, Shaan",Patriotic
Zara Si Dosti,Arijit Singh,
Pani Da Rang,Ayushman Khurana,Romance
De De Jagah,Yasser Desai,
Tum Itna Jo Muskura Rahe Ho,Jagjit Singh,Romantic
Ham The Jinke Sahare,Lata Mangeshkar,Sad
Titli,"Chinmayi Sripaada, Gopi Sunder",Romantic
Laung Da Lashkara,"Hard Kaur, Mahalakshmi Iyer",Dance
Maa Ka Phone,Priya Panchal,Dance
Zindagi Ka Safar,Kishore Kumar,Sad
O Saathiya,"Arko, Armaan Malik, Prakriti Kakkar",Romantic
Kasam Ki Kasam,"K. S. Chithra, Shaan",RomanticSad
Gun Gun Guna,"Sunidhi Chauhan, Udit Narayan",Dance
Jeeta Hoon Jiske Liye,"Alka Yagnik, Kumar Sanu",Romantic
Aye Khuda (Duet),"Rahat Fateh Ali Khan, Shreya Ghoshal",Sad
Dreamum Wakeupum,Soumya Rai,Dance
Balma Tum Balma Ho Mere Khali,Kavita Krishnamurthy,Dance
Ishq Bina,"A.R. Rahman, Anuradha Sriram, Sonu Nigam, Sujatha Mohan",Romantic
Ab Tere Bin,Kumar Sanu,Sad
Ankhiyaan,Kanika Kapoor,Sad
Teri Yaad,Ghulam Ali,Sad
Jalwa,"Earl, Wajid",Dance
Judaai,Falak Shabir,Sad
Aayat,"Altamash Faridi, Arijit Singh, Farhan Sabri, Mujtaba Aziz Naza, Shadab",Sad
Dil Dooba,"Shreya Ghoshal, Sonu Nigam",Dance
Pyaar Deewana Hota Hai,Kishore Kumar,Romantic
Nazrein Mili Dil Dhadka,"Alka Yagnik, Udit Narayan",Dance
Po Po,"Aaman Trikha, Himesh Reshammiya, Vikas Bhalla",Dance
Son Of Sardaar,"Aaman Trikha, Himesh Reshammiya",Dance
Roobaroo,"A.R. Rahman, Naresh Iyer",Dance
Khush Rahe Tu Sada,Mohammed Rafi,Sad
Chaar Kadam,"Shaan, Shreya Ghoshal",Romantic
Are Re Are,"Lata Mangeshkar, Udit Narayan",Dance
Shiddat,Armaan Malik,Sad
Dil Kehta Hai,"Alka Yagnik, Kumar Sanu",Sad
Dilnashin Dilnashin,K.K.,Dance
Sawaar Loon,Monali Thakur,Dance
Zehnaseeb,"Chinmayi Sripaada, Shekhar Ravjiani",Dance
"Joote Do, Paise Lo","Lata Mangeshkar, S.P. Balasubrahmanyam",Dance
Dekha Ek Khwab,"Kishore Kumar, Lata Mangeshkar",Romantic
Maa,Shankar Mahadevan,Sad
Jogi Mahi,"Himani Kapoor, Shekhar Ravjiani, Sukhwinder Singh",Dance
Mat Ja Re,Ankit Tiwari,Dance
Ooh La La,"Bappi Lahiri, Shreya Ghoshal",Dance
Bhangda Pa,"Asees Kaur, Divya Kumar, Vishal Dadlani",Dance
Jhoka Hawa Ka Aaj Bhi,"Hariharan, Kavita Krishnamurthy",Sad
Dhol Baaje,"Anjjan, Meet Bros, Monali Thakur",Dance
Aaj Hai Sagaai,"Abhijeet, Alka Yagnik",Dance
Galat Baat Hai,"Javed Ali, Neeti Mohan",DanceRomantic
Yeh Ladka Hai Deewana,"Alka Yagnik, Udit Narayan",Dance
Des Rangila,Mahalaxmi Iyer,DancePatriotic
Roshni Se,"Abhijeet, Alka Yagnik",Romantic
I Love You,"Ash King, Clinton Cerejo",Romantic
Ishq Wala Love,"Neeti Mohan, Salim Merchant",
O Janiya,Neha Kakkar,Dance
Musafir,K.K.,
Mehndi Laga Ke Rakhna,"Lata Mangeshkar, Udit Narayan",Dance
Gori Gori,"Anu Malik, K.K., Shreya Ghoshal, Sunidhi Chauhan",Dance
Gori Gori Gori Gori,"Anu Malik, Shreya Ghosal, Sunidhi Chauhan",Romantic
Bakhuda Tumhi Ho,"Alka Yagnik, Atif Aslam",Romantic
Ishq Hai Ishq Hai,Jayshree Shivram,Sad
Mere Nishaan,"Anjjan, Kailash Kher, Meet Bros",
Prem Mein Tohre,Asha Bhosle,Romantic
Halo Re,Aaman Trikha,Dance
Jogiya,"Anuradha Paudwal, Sukhwinder Singh",Sad
Aila Re Aila,Daler Mehndi,Dance
Hum Saath-Saath Hain,"Alka Yagnik, Anuradha Paudwal, Hariharan, Kavita Krishnamurthy, Kumar Sanu, Udit Narayan",Dance
Enu Naam Che Raees,Tarannum Mallik,Dance
Woh Pehli Baar,Shaan,Romantic
Piya Aaye Na,"K.K., Tulsi Kumar",Sad
Aaj Hai Sagai,"Abhijeet, Alka Yagnik",Dance
Rajj Rajj Ke,"Sonakshi Sinha, Vishal Dadlani",Motivational
Daawat e Ishq,"Javed Ali, Sunidhi Chauhan",Dance
Tera Mera Pyar Amar,Lata Mangeshkar,Romantic
Chookar Mere Man Ko,Kishore Kumar,Romantic
Chookar Mere Man Ko,Kishore Kumar,Romantic
Love Is A Waste Of Time,"Shreya Ghoshal, Sonu Nigam",Dance
Zindagi To Bewafa Hai,Mohammed Rafi,Sad
Jo Tumko Ho Pasand Wohi Baat Karenge,Mukesh,Romantic
Bebo,Alisha Chinai,Dance
Tum Bin,K. S. Chithra,Romantic
Chot Lage Tujhko – Sad,"Alka Yagnik, Udit Narayan",Sad
Tujhe Sochta Hoon,K.K.,RomanticSensual
Apni To Jaise Taise,Kishore Kumar,Dance
Mast Kalandar,"Master Saleem, Rehan Khan, Sajid Khan",Dance
Dhoom 3 Mashup,,Dance
It’s Magic,Taz,Dance
It’s Magic,Taz,Dance
Nikamma,Rahat Fateh Ali Khan,
Nikamma,Rahat Fateh Ali Khan,
Jigar Da Tukda,"Salim Merchant, Shraddha Pandit",Dance
It’s the Time to Disco,"K.K., Loy Mendonsa, Shaan, Vasundhara Das",Dance
Maar Daala,Kavita Krishnamurthy,Dance
Tumhe Apna Banane Ka,"Armaan Malik, Neeti Mohan",Romantic
Ho Gaya Hai Tujhko To Pyar Sajna,"Lata Mangeshkar, Udit Narayan",Romantic
Suno Aisha,"Amit Trivedi, Ash King, Nakash Aziz",Dance
Jee Ve Sohaneya,Nooran Sisters,Sad
Hai Junoon,K.K.,Dance
Kuch To Hai,Armaan Malik,Sad
Ban Dance Mein Kutta,"Divya Kumar, Shivi, Uvie",Dance
Bakheda,"Sukhwinder Singh, Sunidhi Chauhan",
Bhooli Bisri Ek Kahani,Anuradha Paudwal,Sad
Milan Abhi Aadha Adhura,"Shreya Ghoshal, Udit Narayan",Romantic
Ishqyaun Dhishyaun,Aditya Narayan,Romantic
Saat Ajube Iss Duniya Mein,"Mohammed Rafi, Mukesh",
Maahi Ve,"Richa Sharma, Sukhwinder Singh",DanceSad
Rangdaari,"Arko, Navraj Hans",Sad
Rangdaari,"Arko, Navraj Hans",Sad
Ye Tune Kya Kiya,Javed Bashir,Romantic
Chak De India,"Marianne D'Cruz, Salim Merchant, Sukhwinder Singh",DanceMotivationalPatriotic
Saanwali Si Ek Ladki,Udit Narayan,Romantic
Dil Se Nikal Kar Dil Ko Gayee Hain,"Anuradha Paudwal, Suresh Wadkar",Dance
Dhak Dhak Karne Laga,"Anuradha Paudwal, Udit Narayan",Romantic
Kabhi Jo Badal Barse,Arijit Singh,Romantic
Bhar Do Jholi Meri,Adnan Sami,Devotional
Give Me Some Sunshine,"Sharman Joshi, Suraj Jagan",Sad
Dil Leke,"Shaan, Shreya Ghoshal",DanceRomantic
Yeh Mera Diwanapan Hai,Mukesh,Sad
O Jaana,"Alka Yagnik, K.K., Kamaal khan, Udit Narayan",DanceRomantic
Love Mashup 2016 (Kiran Kamath),Multiple,Romantic
Bhoot Aaya,Mika Singh,
Abhagi Piya Ki,"Ahmed Hussain, Kanika Kapoor, Mohammed. Hussain, Raja Hasan",Sad
Rang Laal,"Aditi Singh Sharma, Dev Negi, John Abraham",Dance
Bas Tu Hai,"Arijit Singh, Jonita Gandhi",RomanticSad
Tanhaiyaan,Amit Mishra,Sad
Jaane Kyun,Vishal Dadlani,Dance
Dagabaaz Re,"Rahat Fateh Ali Khan, Shreya Ghoshal",Romantic
Jane Kyun,"Alka Yagnik, Udit Narayan",Romantic
Khuli Falak Mein,Mohammed Rafi,Romantic
Sajna Mein Teri Tu Mera,"Anuradha Paudwal, Vipin Sachdeva",Romantic
Zindagi Do Pal Ki,K.K.,Romantic
Tauba Yeh Matwali Chaal,Mukesh,Dance
Main Hoon Hero Tera,Armaan Malik,Romantic
Daata Tu,Shreya Ghoshal,Motivational
Ye Dosti Hum Nahi Todenge,"Kishore Kumar, Manna Dey",
Saathiya Nahi Jaana,"Lata Mangeshkar, Mohammed Rafi",RomanticSad
Ishq Hua,"Shreya Ghoshal, Sonu Nigam",Romantic
Bloody Hell,Sunidhi Chauhan,Dance
Dil Se Re,"A.R. Rahman, Anupama Deshpande, Anuradha Sriram",Romantic
Phatte Tak Nachna,Sunidhi Chauhan,Dance
Meer-E-Kaarwan,"Amit Mishra, Neeti Mohan",Sad
Ratta Maar,"Shefali Alvares, Vishal Dadlani",
Raat Ka Nasha,K. S. Chithra,Dance
Maa Da Laadla,Master Saleem,Dance
O Re Piya,Rahat Fateh Ali Khan,Sad
Jhanjariya Meri Chanak,Alka Yagnik,Dance
Pareshaan,Shalmali Kholgade,Romantic
Paisa Paisa,"Manak-E, RDB, Selina",Dance
Mere Haath Mein,"Sonu Nigam, Sunidhi Chauhan",Romantic
Do Lafzon Ki Hai Dil Ki Kahani,"Amitabh Bachchan, Asha Bhosle, Sharad Kumar",Dance
Ishq Sufiyana (Male),Kamal Khan,Romantic
Hum Hain Insaaf,"Babu Haabi, Naezy",
Meri Maa,K.K.,Sad
Zindagi Tujhse Kya Karen Shikvey,Amit Mishra,Sad
Dance Pe Chance,"Labh Janjua, Sunidhi Chauhan",Dance
Tu Hi Hai,Armaan Malik,Romantic
Gehra Ishq,Shekhar Ravjiani,Romantic
Love Me Love Me,"Amrita Kak, Wajid",Dance
Saajna,Falak Shabir,Romantic
Tere Ho Ke Rahenge,Arijit Singh,Romantic
Sai Baba Bolo (Album Version),"Anup Jalota, Anuradha Paudwal, Jani Baboo, Mohammed Rafi",Devotional
Khudaya Ve Ishq Hai Kaisa,Salim Merchant,Sad
Pardesi Pardesi,"Bela, Suresh Wadkar",Sad
Gulabi,"Jigar Saraiya, Priya Saraiya",Dance
Dus Bahane,"K.K., Shaan",Dance
Main Agar Kahoon,"Shreya Ghoshal, Sonu Nigam",Romantic
Main Aisa Kyun Hoon,Shaan,Dance
Main Aisa Kyon Hoon,Shaan,Dance
Mein Chali Mein Chali,"Lata Mangeshkar, Mohammed Rafi",Romantic
Sharabi,"Nindy Kaur, Shekhar Ravjiani, Vishal Dadlani",Dance
Labon Ka Karobaar,Papon,Romantic
Main Kya Karoon,Nikhil Paul George,Dance
Sawan Ka Mahina,"Lata Mangeshkar, Mukesh",Romantic
Taang Uthake,"Mamta Sharma, Mika Singh, Neeti Mohan, Sohail Sen",Dance
Hamari Shaadi Mein,"Babul Supriyo, Shreya Ghoshal",Dance
Ishq Risk,Rahat Fateh Ali Khan,Romantic
Dil Vich Lagya,"Akriti Kakar, Kunal Ganjawala, Sonu Nigam",Dance
Khalbali,"A.R. Rahman, Mohammed Aslam, Nacim",Dance
Safarnama,Lucky Ali,Dance
My Dil Goes Mmmm,"Gayatri Iyer, Shaan",Romantic
